StockCode,Description,cluster
21064,BOOM BOX SPEAKER BOYS,0
84341B,SMALL PINK MAGIC CHRISTMAS TREE,0
84509G,SET OF 4 FAIRY CAKE PLACEMATS ,0
16235,RECYCLED PENCIL WITH RABBIT ERASER,0
20986,BLUE CALCULATOR RULER,0
20832,RED FLOCK LOVE HEART PHOTO FRAME,0
84846A,SCENTED CANDLE IN DIGITALIS TIN,0
22442,GROW YOUR OWN FLOWERS SET OF 3,0
21769,VINTAGE POST OFFICE CABINET,0
20798,CLEAR MILKSHAKE GLASS,0
22320,BIRDS MOBILE VINTAGE DESIGN,0
21561,DINOSAUR LUNCH BOX WITH CUTLERY,0
85132B,CHARLIE AND LOLA TABLE TINS,1
85132C,CHARLIE AND LOLA FIGURES TINS,1
22215,CAKE STAND WHITE TWO TIER LACE,1
20675,BLUE POLKADOT BOWL,0
21239,PINK  POLKADOT CUP,0
21987,PACK OF 6 SKULL PAPER CUPS,0
21988,PACK OF 6 SKULL PAPER PLATES,0
21989,PACK OF 20 SKULL PAPER NAPKINS,0
22316,200 BENDY SKULL STRAWS,0
22332,SKULLS PARTY BAG + STICKER SET,0
21206,STRAWBERRY HONEYCOMB  GARLAND ,1
20677,PINK POLKADOT BOWL,0
22806,SET OF 6 T-LIGHTS WEDDING CAKE ,0
22893,MINI CAKE STAND T-LIGHT HOLDER,0
85159A,"BLACK TEA,COFFEE,SUGAR JARS",0
21784,SHOE SHINE BOX ,0
22849,BREAD BIN DINER STYLE MINT,0
17090D,VANILLA INCENSE 40 CONES IN TIN,0
17090A,LAVENDER INCENSE 40 CONES IN TIN,0
72127,COLUMBIAN CANDLE ROUND ,0
72133,COLUMBIAN CANDLE RECTANGLE,0
84763,ZINC FINISH 15CM PLANTER POTS,0
22450,SILK PURSE BABUSHKA BLUE,0
10124G,ARMY CAMO BOOKCOVER TAPE,0
84519B,CARROT CHARLIE+LOLA COASTER SET,0
22505,MEMO BOARD COTTAGE DESIGN,0
22514,CHILDS GARDEN SPADE BLUE,0
21504,SKULLS GREETING CARD,0
22292,HANGING CHICK  YELLOW DECORATION,0
21211,SET OF 72 SKULL PAPER  DOILIES,0
22045,SPACEBOY GIFT WRAP,0
90175C,BLUE GLASS CHUNKY CHARM BRACELET,0
90180A,BLACK+WHITE NECKLACE W TASSEL,0
90178A,AMBER CHUNKY GLASS+BEAD NECKLACE,0
22986,GINGHAM ROSE WRAP,0
20984,12 PENCILS TALL TUBE POSY,0
22436,12 COLOURED PARTY BALLOONS,0
21465,PINK FLOWER CROCHET FOOD COVER,0
21470,FLOWER VINE RAFFIA FOOD COVER,0
16012,FOOD/DRINK SPONGE STICKERS,0
85025C,PINK HEART SHAPE PHOTO FRAME,0
21849,SILVER DIAMANTE PEN IN GIFT BOX,0
85124B,BLUE JUICY FRUIT PHOTO FRAME,0
85124C,GREEN JUICY FRUIT PHOTO FRAME,0
20828,GLITTER BUTTERFLY CLIPS,0
21623,VINTAGE UNION JACK MEMOBOARD,1
16156S,WRAP PINK FAIRY CAKES ,0
85049F,BABY BOOM RIBBONS ,0
22426,ENAMEL WASH BOWL CREAM,0
90082D,DIAMANTE BOW BROOCH BLACK COLOUR,0
90082A,DIAMANTE BOW BROOCH GREEN COLOUR,0
90082B,DIAMANTE BOW BROOCH RED COLOUR,0
90081A,LILY BROOCH AMETHYST COLOUR,0
90204,PAIR OF ENAMEL BUTTERFLY HAIRCLIP,0
90185B,AMETHYST DIAMANTE EXPANDABLE RING,0
90195A,PURPLE GEMSTONE BRACELET,0
90195B,BLACK GEMSTONE BRACELET,0
90196A,PURPLE GEMSTONE NECKLACE 45CM,0
90199A,5 STRAND GLASS NECKLACE BLACK,0
90186A,AMETHYST HOOP EARRING FLORAL LEAF,0
20894,HANGING BAUBLE T-LIGHT HOLDER LARGE,0
85106,CUT GLASS HEXAGON T-LIGHT HOLDER,0
21415,CLAM SHELL SMALL ,0
21416,CLAM SHELL LARGE,0
21417,COCKLE SHELL DISH,0
22343,PARTY PIZZA DISH RED RETROSPOT,0
22474,SPACEBOY TV DINNER TRAY,0
18097A,PINK TALL PORCELAIN T-LIGHT HOLDER ,0
18097C,WHITE TALL PORCELAIN T-LIGHT HOLDER,0
21902,"KEY FOB , FRONT  DOOR ",0
21901,"KEY FOB , BACK DOOR ",0
21948,SET OF 6 CAKE CHOPSTICKS,0
20759,CHRYSANTHEMUM POCKET BOOK ,0
20760,GARDEN PATH POCKET BOOK,0
20757,RED DAISY POCKET BOOK ,0
85185D,FROG SOCK PUPPET,0
85185B,PINK HORSE SOCK PUPPET,0
22439,6 ROCKET BALLOONS ,0
79164,BLACK WINE GLASS,0
84683,CLASSICAL ROSE CANDLESTAND,0
79163,BLACK CHAMPAGNE GLASS,0
22175,PINK OWL SOFT TOY,0
21155,RED RETROSPOT PEG BAG,0
15060B,FAIRY CAKE DESIGN UMBRELLA,0
22985,"WRAP, BILLBOARD FONTS DESIGN",0
22821,GIFT BAG PSYCHEDELIC APPLES,0
22705,WRAP GREEN PEARS ,0
72801C,4 ROSE PINK DINNER CANDLES,0
72801D,4 SKY BLUE DINNER CANDLES,0
21735,TWO DOOR CURIO CABINET,0
21500,PINK POLKADOT WRAP ,0
15036,ASSORTED COLOURS SILK FAN,0
BANK CHARGES,Bank Charges,0
21539,RED RETROSPOT BUTTER DISH,0
22341,LOVE GARLAND PAINTED ZINC ,0
22452,MEASURING TAPE BABUSHKA PINK,0
21508,VINTAGE KID DOLLY CARD ,0
21499,BLUE POLKADOT WRAP,0
84952C,MIRROR LOVE BIRD T-LIGHT HOLDER,0
84952B,BLACK LOVE BIRD T-LIGHT HOLDER,0
35001G,HAND OPEN SHAPE GOLD,0
22264,FELT FARM ANIMAL WHITE BUNNY ,0
22181,SNOWSTORM PHOTO FRAME FRIDGE MAGNET,0
21392,RED POLKADOT PUDDING BOWL,0
21393,BLUE POLKADOT PUDDING BOWL,0
21268,VINTAGE BLUE TINSEL REEL,0
85144,JARDIN ETCHED GLASS BUTTER DISH,0
21025,SPACE FROG,0
21031,SPACE CADET BLACK,0
21030,SPACE CADET RED,0
21026,SPACE OWL,0
21032,SPACE CADET WHITE,0
21578,WOODLAND DESIGN  COTTON TOTE BAG,0
21357,TOAST ITS - DINOSAUR,0
20766,GARDEN PATH SKETCHBOOK,0
21399,BLUE POLKADOT COFFEE MUG,0
22562,MONSTERS STENCIL CRAFT,0
21714,CITRONELLA CANDLE GARDEN POT,0
20751,FUNKY WASHING UP GLOVES ASSORTED,0
22636,CHILDS BREAKFAST SET CIRCUS PARADE,0
21426,WOODLAND STORAGE BOX SMALL,0
21581,SKULLS  DESIGN  COTTON TOTE BAG,0
90002D,FLOWER BURST SILVER RING CRYSTAL,0
21900,"KEY FOB , SHED",0
22031,BOTANICAL LAVENDER BIRTHDAY CARD,0
22777,GLASS CLOCHE LARGE,0
21788,KIDS RAIN MAC BLUE,0
22408,MONEY BOX CONFECTIONERY DESIGN,0
22406,MONEY BOX KINGS CHOICE DESIGN,0
22275,WEEKEND BAG VINTAGE ROSE PAISLEY,0
22042,CHRISTMAS CARD SINGING ANGEL,0
22089,PAPER BUNTING VINTAGE PAISLEY,0
85066,CREAM SWEETHEART MINI CHEST,0
21129,SILVER FISHING GNOME ,0
21059,PARTY INVITES DINOSAURS,0
22877,NUMBER TILE COTTAGE GARDEN 9,1
22869,NUMBER TILE COTTAGE GARDEN 1,1
22878,NUMBER TILE COTTAGE GARDEN No,1
21240,BLUE POLKADOT CUP,0
21927,BLUE/CREAM STRIPE CUSHION COVER ,0
21925,UNION STRIPE CUSHION COVER ,0
22763,KEY CABINET MA CAMPAGNE,0
22334,DINOSAUR PARTY BAG + STICKER SET,0
22655,VINTAGE RED KITCHEN CABINET,0
22060,LARGE CAKE STAND HANGING HEARTS,0
22061,LARGE CAKE STAND  HANGING STRAWBERY,1
21531,RED RETROSPOT SUGAR JAM BOWL,0
21039,RED RETROSPOT SHOPPING BAG,0
21157,RED RETROSPOT WASHBAG,0
16161P,WRAP ENGLISH ROSE ,0
16161M,WRAP  PINK FLOCK,0
85214,TUB 24 PINK FLOWER PEGS,0
72232,FENG SHUI PILLAR CANDLE,0
84247G,"DECOUPAGE,GREETING CARD,",0
21530,DAIRY MAID TOASTRACK,0
21528,DAIRY MAID TRADITIONAL TEAPOT ,0
21114,LAVENDER SCENTED FABRIC HEART,0
20615,BLUE POLKADOT PASSPORT COVER,0
47021G,SET/6 BEAD COASTERS GAUZE BAG GOLD,0
22443,GROW YOUR OWN HERBS SET OF 3,0
21807,WHITE CHRISTMAS STAR DECORATION,0
22689,DOORMAT MERRY CHRISTMAS RED ,0
22591,CARDHOLDER GINGHAM CHRISTMAS TREE,0
22504,CABIN BAG VINTAGE RETROSPOT,0
22158,3 HEARTS HANGING DECORATION RUSTIC,0
22621,TRADITIONAL KNITTING NANCY,0
79000,MOROCCAN TEA GLASS,0
85049B,LUSH GREENS RIBBONS,0
21878,PACK OF 6 SANDCASTLE FLAGS ASSORTED,0
85131A,BEADED PEARL HEART WHITE ON STICK,1
15056bl,EDWARDIAN PARASOL BLACK,0
15056p,EDWARDIAN PARASOL PINK,0
20941,FROG CANDLE,0
21066,VINTAGE RED MUG,0
21205,MULTICOLOUR 3D BALLS GARLAND,0
21361,LOVE LARGE WOOD LETTERS ,0
21876,POTTERING MUG,0
22167, OVAL WALL MIRROR DIAMANTE ,0
22200,FRYING PAN PINK POLKADOT,0
22412,METAL SIGN NEIGHBOURHOOD WITCH ,1
22525,CHILDRENS GARDEN GLOVES PINK,0
47566b,TEA TIME PARTY BUNTING,0
72349b,SET/6 PURPLE BUTTERFLY T-LIGHTS,0
84872a,TEATIME FUNKY FLOWER BACKPACK FOR 2,0
84970l,SINGLE HEART ZINC T-LIGHT HOLDER,0
84970s,HANGING HEART ZINC T-LIGHT HOLDER,0
85039a,SET/4 RED MINI ROSE CANDLE IN BOWL,0
10123C,HEARTS WRAPPING TAPE ,0
10120,DOGGY RUBBER,0
84006,MAGIC TREE -PAPER FLOWERS,0
20767,BLUE PAISLEY JOURNAL ,0
90094,NECKLACE+BRACELET SET FRUIT SALAD ,0
21882,SKULLS TAPE,0
20886,BOX OF 9 PEBBLE CANDLES,0
21945,STRAWBERRIES  DESIGN FLANNEL ,0
22133,PINK LOVE HEART SHAPE CUP,0
22456,NATURAL SLATE CHALKBOARD LARGE ,1
22891,TEA FOR ONE POLKADOT,0
47566,PARTY BUNTING,0
18098c,PORCELAIN BUTTERFLY OIL BURNER,0
20655,QUEEN OF SKIES LUGGAGE TAG,0
21100,CHARLIE AND LOLA CHARLOTTE BAG,1
21201,TROPICAL  HONEYCOMB PAPER GARLAND ,1
21558,SKULL LUNCH BOX WITH CUTLERY ,0
21865,PINK UNION JACK  PASSPORT COVER ,1
22132,RED LOVE HEART SHAPE CUP,0
22166,WALL MIRROR RECTANGLE DIAMANTE PINK,0
22518,CHILDS GARDEN BRUSH BLUE,0
22628,PICNIC BOXES SET OF 3 RETROSPOT ,0
84509c,SET OF 4 POLKADOT PLACEMATS ,0
84534b,FAIRY CAKE NOTEBOOK A5 SIZE,0
84559a,3D SHEET OF DOG STICKERS,0
84596e,SMALL LICORICE DES PINK BOWL,0
84884a,ANT WHITE WIRE HEART SPIRAL,0
85014a,BLACK/BLUE POLKADOT UMBRELLA,0
85014b,RED RETROSPOT UMBRELLA,0
85036b,CHOCOLATE 1 WICK MORRIS BOX CANDLE,1
72803b,OCEAN SCENT CANDLE JEWELLED DRAWER,0
84993A,75 GREEN PETIT FOUR CASES,0
84987,SET OF 36 TEATIME PAPER DOILIES,0
20998,ROSE DU SUD OVEN GLOVE,0
22702,BLACK AND WHITE CAT BOWL,0
84925D,LA PALMIERA WALL THERMOMETER,0
21078,SET/20 STRAWBERRY PAPER NAPKINS ,0
22105,MIRROR MOSAIC GOBLET CANDLE HOLDER,0
22163,HEART STRING MEMO HOLDER HANGING,0
22216,T-LIGHT HOLDER WHITE LACE,0
22248,DECORATION  PINK CHICK MAGIC GARDEN,0
22250,DECORATION  BUTTERFLY  MAGIC GARDEN,0
22251,BIRDHOUSE DECORATION MAGIC GARDEN,0
22255,FELT TOADSTOOL  SMALL,0
22288,HANGING METAL RABBIT DECORATION,0
22363,GLASS JAR MARMALADE ,0
22395,PAPERWEIGHT VINTAGE PAISLEY,0
22483,RED GINGHAM TEDDY BEAR ,0
22546,MINI JIGSAW PURDEY,0
22609,PENS ASSORTED SPACEBALL,0
22762,CUPBOARD 3 DRAWER MA CAMPAGNE,1
22811,SET OF 6 T-LIGHTS CACTI ,0
22882,NUMBER TILE VINTAGE FONT 3,1
22884,NUMBER TILE VINTAGE FONT 5,1
22908,PACK OF 20 NAPKINS RED APPLES,0
35599B,BLACK CHRISTMAS TREE 120CM,0
44234,ASSORTED CIRCULAR MOBILE,0
71143,SILVER BOOK MARK WITH BEADS,1
72351A,SET/6 TURQUOISE BUTTERFLY T-LIGHTS,0
75049L,LARGE CIRCULAR MIRROR MOBILE,0
75131,METAL TUBE CHIME ON BAMBOO,0
79191B,RETRO PLASTIC POLKA TRAY,0
82001S,VINYL RECORD FRAME SILVER,0
84270,ASSTD DESIGN BUBBLE GUM RING,0
84660C,PINK STITCHED WALL CLOCK,0
84661B,BLACK SQUARE TABLE CLOCK,0
84673B,BLUE FLY SWAT,0
84927A,WAKE UP COCKEREL TILE HOOK,0
84927F,PSYCHEDELIC TILE HOOK,0
85025B,EAU DE NILE HEART SHAPE PHOTO FRAME,0
85054,FRENCH ENAMEL POT W LID,0
85055,FRENCH ENAMEL UTENSIL HOLDER,0
85167B,BLACK GRAND BAROQUE PHOTO FRAME,0
85169A,IVORY LOVE BIRD CANDLE,0
85169C,EAU DE NIL LOVE BIRD CANDLE,0
85169D,PINK LOVE BIRD CANDLE,0
85203,HANGING WOOD AND FELT BUTTERFLY ,0
90000D,COPPER/OLIVE GREEN FLOWER NECKLACE,0
90003E,GREEN PAIR HEART HAIR SLIDES,0
90028,NEW BAROQUE LARGE NECKLACE BLK/WHIT,0
90060F,FIRE POLISHED GLASS NECKL GREEN,0
90114,SUMMER DAISIES BAG CHARM,0
90115,SUMMER BUTTERFLIES BAG CHARM,0
90120B,BLUE MURANO TWIST BRACELET,0
90141A,GREEN PENDANT TRIPLE SHELL NECKLACE,0
90199B,5 STRAND GLASS NECKLACE AMETHYST,0
90205A,LARGE MINT DIAMANTE HAIRSLIDE,0
90214B,"LETTER ""B"" BLING KEY RING",0
90214C,"LETTER ""C"" BLING KEY RING",0
90214F,"LETTER ""F"" BLING KEY RING",0
90214I,"LETTER ""I"" BLING KEY RING",0
90214L,"LETTER ""L"" BLING KEY RING",0
90214N,"LETTER ""N"" BLING KEY RING",0
90214Y,"LETTER ""Y"" BLING KEY RING",0
16218,CARTOON  PENCIL SHARPENERS,0
16225,RATTLE SNAKE EGGS,0
20686,DOLLY MIXTURE CHILDREN'S UMBRELLA,0
21200,MULTICOLOUR HONEYCOMB PAPER GARLAND,1
21051,RIBBONS PURSE ,0
21112,"SWISS ROLL TOWEL, PINK  SPOTS",0
21219,SET/4 BADGES BALLOON GIRL,0
21224,SET/4 SKULL BADGES,0
21261,GREEN GOOSE FEATHER CHRISTMAS TREE ,0
21263,GREEN GOOSE FEATHER TREE 60CM,0
21286,RETROSPOT CANDLE  LARGE,0
21446,12 RED ROSE PEG PLACE SETTINGS,0
21619,4 VANILLA BOTANICAL CANDLES,0
21640,ASSORTED TUTTI FRUTTI  FOB NOTEBOOK,0
21675,BUTTERFLIES STICKERS,0
21725,SWEETIES  STICKERS,0
21828,EIGHT PIECE SNAKE  SET,0
21829,DINOSAUR KEYRINGS ASSORTED,0
21903,MAN FLU METAL SIGN,1
21936,RED RETROSPOT PICNIC BAG,0
22959,WRAP CHRISTMAS VILLAGE,0
17084R,ASSORTED INCENSE PACK,0
17091J,VANILLA INCENSE IN TIN,0
21027,NINJA RABBIT PINK,0
84539,KNITTED RABBIT DOLL ,0
90096,NECKLACE+BRACELET SET BLUE BLOSSOM,0
21095,SET/6 POSIES PAPER PLATES,0
22734,amazon,0
22139,amazon,0
85018D,YULETIDE IMAGES S/6 PAPER BOXES,0
22732,3D VINTAGE CHRISTMAS STICKERS ,0
47503J,SET/3 FLORAL GARDEN TOOLS IN BAG,0
37464,ROBOT MUG IN DISPLAY BOX,0
84247N,PACK/12 BLUE FOLKART CARDS,0
84247K,"FOLK ART GREETING CARD,pack/12",0
22035,VINTAGE CARAVAN GREETING CARD ,0
21250,SET OF SKULL WALL STICKERS,0
21677,HEARTS  STICKERS,0
47504K,ENGLISH ROSE GARDEN SECATEURS,0
84212,"ASSORTED FLOWER COLOUR ""LEIS""",0
21377,SMALL CAMPHOR WOOD FIELD  MUSHROOM,0
21379,CAMPHOR WOOD PORTOBELLO MUSHROOM,0
37489D,PINK/GREEN FLOWER DESIGN BIG MUG,0
17107D,"FLOWER FAIRY,5 SUMMER B'DRAW LINERS",0
37489B,BLUE/YELLOW FLOWER DESIGN BIG MUG,0
37489C,GREEN/BLUE FLOWER DESIGN BIG MUG,0
21932,SCANDINAVIAN PAISLEY PICNIC BAG,0
21933,PINK VINTAGE PAISLEY PICNIC BAG,0
37489A,YELLOW/PINK FLOWER DESIGN BIG MUG,0
22072,RED RETROSPOT TEA CUP AND SAUCER ,0
21905,MORE BUTTER METAL SIGN ,1
22414,DOORMAT NEIGHBOURHOOD WITCH ,0
22116,METAL SIGN HIS DINNER IS SERVED,1
85130A,BEADED PEARL HEART WHITE LARGE,0
85129C,BEADED CRYSTAL HEART BLUE SMALL,0
22246,"GARLAND, MAGIC GARDEN 1.8M",0
84849A,HELLO SAILOR BLUE SOAP HOLDER,0
22137,BATHROOM SET LOVE HEART DESIGN,0
85230B,CINNAMON SCENTED VOTIVE CANDLE,0
85230F,JASMINE VOTIVE CANDLE,0
22306,SILVER MUG BONE CHINA TREE OF LIFE,0
20734,SILVER MINI TAPE MEASURE ,0
20960,WATERMELON BATH SPONGE,0
35970,ZINC FOLKART SLEIGH BELLS,0
47559b,TEA TIME OVEN GLOVE,0
47591d,PINK FAIRY CAKE CHILDRENS APRON,0
48173c,DOORMAT BLACK FLOCK ,0
82494l,WOODEN FRAME ANTIQUE WHITE ,0
84030e,ENGLISH ROSE HOT WATER BOTTLE,1
84997b,RED 3 PIECE RETROSPOT CUTLERY SET,0
84997c,BLUE 3 PIECE POLKADOT CUTLERY SET,0
84997d,PINK 3 PIECE POLKADOT CUTLERY SET,0
85049a,TRADITIONAL CHRISTMAS RIBBONS,0
85049e,SCANDINAVIAN REDS RIBBONS,0
85099f,JUMBO BAG STRAWBERRY,0
85123a,WHITE HANGING HEART T-LIGHT HOLDER,0
84849D,HOT BATHS SOAP HOLDER,0
84507C,BLUE CIRCLES DESIGN MONKEY DOLL,0
20910,VINTAGE PHOTO ALBUM PARIS DAYS,0
82616B,FRAPPUCINO SCARF KNITTING KIT,0
90128B,BLUE LEAVES AND BEADS PHONE CHARM,0
90196B,BLACK GEMSTONE NECKLACE 45CM,0
90198B,VINTAGE ROSE BEAD BRACELET BLACK,0
90152B,BLUE/GREEN SHELL NECKLACE W PENDANT,0
90151,SILVER/NATURAL SHELL NECKLACE,0
20661,BLUE POLKADOT PURSE ,0
20652,BLUE POLKADOT LUGGAGE TAG ,0
21845,DAIRY MAID STRIPE MUG,0
22398,MAGNETS PACK OF 4 SWALLOWS,0
84877D,BLUE ROUND COMPACT MIRROR,0
20657,TROPICAL LUGGAGE TAG,0
47422,ASSORTED MONKEY SUCTION CUP HOOK,0
21642,ASSORTED TUTTI FRUTTI PEN,0
47503H,ASS FLORAL PRINT SPIRIT LEVEL ,0
72130,COLUMBIAN CANDLE ROUND,0
72128,COLUMBIAN CANDLE ROUND,0
47343A,FUSCHIA FLOWER PURSE WITH BEADS,1
72802A,ROSE SCENT CANDLE IN JEWELLED BOX,0
72802B,OCEAN SCENT CANDLE IN JEWELLED BOX,0
21054,NURSE'S BAG SOFT TOY,0
22339,CHRISTMAS TREE PAINTED ZINC ,0
22337,ANGEL DECORATION PAINTED ZINC ,0
84562A,PINK/WHITE RIBBED MELAMINE JUG,0
21040,MODERN VINTAGE COTTON SHOPPING BAG,0
21937,STRAWBERRY   PICNIC BAG,0
22701,PINK DOG BOWL,0
22362,GLASS JAR PEACOCK BATH SALTS,0
82011C,BATHROOM SCALES FOOTPRINTS IN SAND,0
84865,NEW BAROQUE BLACK PHOTO ALBUM,0
21287,SCENTED VELVET LOUNGE CANDLE ,0
79337,BLUE FLOCK GLASS CANDLEHOLDER,0
85111,SILVER GLITTER FLOWER VOTIVE HOLDER,0
22307,GOLD MUG BONE CHINA TREE OF LIFE,0
85078,SCANDINAVIAN 3 HEARTS NAPKIN RING,0
85036B,CHOCOLATE 1 WICK MORRIS BOX CANDLE,1
85034C,3 ROSE MORRIS BOXED CANDLES,1
84614A,PINK BAROQUE FLOCK CANDLE HOLDER,0
22509,SEWING BOX RETROSPOT DESIGN ,0
90145,SILVER HOOP EARRINGS WITH FLOWER,0
90143,SILVER BRACELET W PASTEL FLOWER,0
90010A,MIDNIGHT BLUE GLASS/SILVER BRACELET,0
90010B,BLACK/WHITE GLASS/SILVER BRACELET,0
90050,CRACKED GLAZE NECKLACE IVORY,0
90053,CRACKED GLAZE EARRINGS IVORY,0
20829,GLITTER HANGING BUTTERFLY STRING,0
21947,SET OF 6 HEART CHOPSTICKS,0
21726,MULTI HEARTS  STICKERS,0
22671,FRENCH LAUNDRY SIGN BLUE METAL,0
20936,FORKED CACTUS CANDLE,0
84924A,WAKE UP COCKEREL CALENDAR SIGN ,0
35810B,ENAMEL BLUE RIM COFFEE CONTAINER,0
35241,ENAMEL BLUE RIM BISCUIT BIN,0
17109D,FLOWER FAIRY INCENSE BOUQUET,0
21011,GLITTER SNOW PEAR TREE DECORATION,0
22853,CAT BOWL VINTAGE CREAM,0
85034B,3 WHITE CHOC MORRIS BOXED CANDLES,1
72800D,4 BLUE DINNER CANDLES SILVER FLOCK,0
84819,DANISH ROSE ROUND SEWING BOX,0
90185D,CRYSTAL DIAMANTE EXPANDABLE RING,0
90175A,WHITE GLASS CHUNKY CHARM BRACELET,0
22079,RIBBON REEL HEARTS DESIGN ,0
90162B,ANT SILVER LIME GREEN BOUDICCA RING,0
90162D,ANT SILVER PURPLE BOUDICCA RING,0
21626,VINTAGE UNION JACK PENNANT,1
90167,BEADED LOVE HEART JEWELLERY SET,0
22403,MAGNETS PACK OF 4 VINTAGE LABELS ,0
22563,HAPPY STENCIL CRAFT,0
84827,ASS DES PHONE SPONGE CRAFT STICKER,0
22799,SWEETHEART WIRE FRUIT BOWL,0
22305,COFFEE MUG PINK PAISLEY DESIGN,0
84898F,YELLOW FLOWERS FELT HANDBAG KIT,0
22415,WHITE TISSUE REAM,0
22256,FELT FARM ANIMAL CHICKEN,0
47310M,"SMALL POP BOX,FUNKY MONKEY",0
84508B,STRIPES DESIGN TEDDY,0
21555,CERAMIC STRAWBERRY TRINKET TRAY,0
22390,PAPERWEIGHT CHILDHOOD MEMORIES,0
84963A,PINK PAINTED KASHMIRI CHAIR,0
72349B,SET/6 PURPLE BUTTERFLY T-LIGHTS,0
84993B,75 BLACK PETIT FOUR CASES,0
85206A,CREAM FELT EASTER EGG BASKET,0
22021,BLUE FELT EASTER EGG BASKET,0
84596G,SMALL CHOCOLATES PINK BOWL,0
21445,12 PINK ROSE PEG PLACE SETTINGS,0
77101A,UNION FLAG WINDSOCK,0
84358,FLOOR LAMP SHADE WOOD BASE,0
21294,ETCHED GLASS COASTER,0
21468,BUTTERFLY CROCHET FOOD COVER,0
22123,PING MICROWAVE APRON,0
22939,APRON APPLE DELIGHT,0
21836,GINGHAM OVEN GLOVE RED HEART ,0
71279,PINK GLASS CANDLEHOLDER,0
22598,CHRISTMAS MUSICAL ZINC TREE,0
22532,MAGIC DRAWING SLATE LEAP FROG ,0
21413,PERIWINKLE T-LIGHT HOLDER,0
79149B,SILICON STAR BULB  BLUE,0
21682,LARGE MEDINA STAMPED METAL BOWL ,0
78034B,BLUE NETTING STORAGE HANGER,0
22894,TABLECLOTH RED APPLES DESIGN ,0
79151B,"SILICON CUBE 25W, BLUE",0
21090,SET/6 COLLAGE PAPER PLATES,0
21209,MULTICOLOUR HONEYCOMB FAN,0
22354,RETROSPOT PADDED SEAT CUSHION,0
21635,MADRAS NOTEBOOK LARGE ,0
35653,VINTAGE BEAD NOTEBOOK,0
85130D,BEADED CRYSTAL HEART PINK LARGE,0
15039,SANDALWOOD FAN,0
84978,HANGING HEART JAR T-LIGHT HOLDER,0
84569D,PACK 6 HEART/ICE-CREAM PATCHES,0
84921,CREAM AND PINK FLOWERS PONY ,0
84508C,BLUE CIRCLES DESIGN TEDDY,0
90086,CRYSTAL FROG PHONE CHARM,0
62018,SOMBRERO ,0
16011,ANIMAL STICKERS,0
85179A,GREEN BITTY LIGHT CHAIN,0
21785,RAIN PONCHO ,0
21650,ASSORTED TUTTI FRUTTI BRACELET,0
84874B,BLUE TRAVEL FIRST AID KIT,0
22674,FRENCH TOILET SIGN BLUE METAL,0
72051S,BAG OF SILVER STONES,0
20764,ABSTRACT CIRCLES SKETCHBOOK ,0
47579,TEA TIME BREAKFAST BASKET,0
21723,ALPHABET HEARTS STICKER SHEET,0
35953,FOLKART STAR CHRISTMAS DECORATIONS,0
84051,ASS COLOUR GLOWING TIARAS,0
21187,WHITE BELL HONEYCOMB PAPER GARLAND ,1
21696,SMALL SILVER TRELLIS CANDLEPOT,0
22034,ROBIN CHRISTMAS CARD,0
20980,36 PENCILS TUBE POSY,0
35958,FOLKART ZINC STAR CHRISTMAS DEC,0
75013B,"STRING OF 8 BUTTERFLIES,PINK",0
22830,UTILTY CABINET WITH HOOKS,0
22684,FRENCH BLUE METAL DOOR SIGN 9,0
82011B,BATHROOM SCALES RUBBER DUCKS,0
21630,FLOOR CUSHION ELEPHANT CARNIVAL,0
21580,RABBIT  DESIGN  COTTON TOTE BAG,0
22231,JIGSAW TREE WITH BIRDHOUSE,0
22859,EASTER TIN BUNNY BOUQUET,0
22860,EASTER TIN CHICKS PINK DAISY,0
22093,MOTORING TISSUE BOX,0
20748,KENSINGTON COFFEE SET,0
85208,SET/12 FUNKY FELT FLOWER PEG IN BAG,0
22129,PARTY CONES CANDY TREE DECORATION,0
22808,SET OF 6 T-LIGHTS EASTER CHICKS,0
20702,PINK PADDED MOBILE,0
85187,S/12 MINI RABBIT EASTER,0
21683,MEDIUM MEDINA STAMPED METAL BOWL ,0
22770,MIRROR CORNICE,0
84563B,BLUE & WHITE BREAKFAST TRAY,0
79190A,RETRO PLASTIC 70'S TRAY,0
15034,PAPER POCKET TRAVELING FAN ,0
85129B,BEADED CRYSTAL HEART GREEN SMALL,0
35924,HANGING FAIRY CAKE DECORATION,0
20671,BLUE TEATIME PRINT BOWL ,0
21904,HOUSE WRECKING METAL SIGN ,1
22843,BISCUIT TIN VINTAGE GREEN,0
22199,FRYING PAN RED RETROSPOT,0
84968A,SET OF 16 VINTAGE ROSE CUTLERY,0
37509,NEW ENGLAND MUG W GIFT BOX,0
47369A,PINK GREEN EMBROIDERY COSMETIC BAG,0
47369B,BLUE GREEN EMBROIDERY COSMETIC BAG,0
47367B,PAIR PADDED HANGERS PINK CHECK,0
21695,SMALL SILVER FLOWER CANDLE POT,0
84773,RED ROSE AND LACE C/COVER,0
21424,WOODLAND STORAGE BOX LARGE ,0
21819,GLITTER CHRISTMAS STAR ,0
22817,CARD SUKI BIRTHDAY,0
16161U,WRAP SUKI AND FRIENDS,0
22252,BIRDCAGE DECORATION TEALIGHT HOLDER,0
21401,BLUE PUDDING SPOON,0
84597C,RETRO PINK BALL ASHTRAY ,0
51020A,SUMMER FUN DESIGN SHOWER CAP,0
51020B,STRIPY DESIGN SHOWER CAP,0
21306,SET/4 DAISY MIRROR MAGNETS,0
21311,SET/4 BIRD MIRROR MAGNETS ,0
21307,SET/4 BUTTERFLY MIRROR MAGNETS,0
21277,FRENCH STYLE EMBOSSED HEART CABINET,0
22475,SKULL DESIGN TV DINNER TRAY,0
90200E,GREEN SWEETHEART BRACELET,0
90062,CARNIVAL BRACELET,0
21616,4 PEAR BOTANICAL DINNER CANDLES,0
37461,FUNKY MONKEY MUG,0
20659,ECONOMY LUGGAGE TAG,0
20985,HEART CALCULATOR,0
84596L,BISCUITS SMALL BOWL LIGHT BLUE,0
84596F,SMALL MARSHMALLOWS PINK BOWL,0
22346,PARTY PIZZA DISH GREEN POLKADOT,0
22344,PARTY PIZZA DISH PINK POLKADOT,0
85215,ASSORTED CHEESE FRIDGE MAGNETS,0
85062,PEARL CRYSTAL PUMPKIN T-LIGHT HLDR,0
22849,"BREAD BIN, DINER STYLE, MINT",0
22847,"BREAD BIN, DINER STYLE, IVORY",0
22984,CARD GINGHAM ROSE ,0
85036C,ROSE 1 WICK MORRIS BOXED CANDLE,1
21202,DOLLY HONEYCOMB GARLAND,1
84531A,PINK KNITTED EGG COSY,0
84531B,BLUE KNITTED EGG COSY,0
21910,WAY OUT METAL SIGN ,1
22461,SAVOY ART DECO CLOCK,1
22833,HALL CABINET WITH 3 DRAWERS,0
22690,DOORMAT HOME SWEET HOME BLUE ,1
84881,BLUE WIRE SPIRAL CANDLE HOLDER,0
21613,S/12 VANILLA  BOTANICAL T-LIGHTS,0
21693,SMALL HAMMERED SILVER CANDLEPOT ,0
84809A,WHITE CHRYSANTHEMUMS ART FLOWER,1
79190D,RETRO PLASTIC DAISY TRAY,0
22157,ANGEL DECORATION WITH LACE PADDED,0
84795B,SUNSET CHECK HAMMOCK,0
20771,CHRYSANTHEMUM  JOURNAL,0
37327,ASSTD MULTICOLOUR CIRCLES MUG,0
85027L,FRENCH CHATEAU LARGE PLATTER ,0
85017C,ENVELOPE 50 CURIOUS IMAGES,0
16010,FOLDING CAMPING SCISSOR W/KNIF & S,0
35001W,HAND OPEN SHAPE DECO.WHITE,0
84707B,PINK JEWELLED MIRROR TRINKET TRAY,0
21167,WHITE SAGE INCENSE,0
51008,AFGHAN SLIPPER SOCK PAIR,0
21713,CITRONELLA CANDLE FLOWERPOT,0
20802,SMALL GLASS SUNDAE DISH CLEAR,0
22052,VINTAGE CARAVAN GIFT WRAP,0
20781,GOLD EAR MUFF HEADPHONES,0
22389,PAPERWEIGHT SAVE THE PLANET,0
84840,SWEETHEART CARRY-ALL BASKET,0
22073,RED RETROSPOT STORAGE JAR,0
20716,PARTY FOOD SHOPPER BAG,0
20782,CAMOUFLAGE EAR MUFF HEADPHONES,0
20847,ZINC HEART LATTICE CHARGER LARGE,0
21291,SMALL POLKADOT CHOCOLATE GIFT BAG ,0
21319,GLASS CHALICE GREEN  SMALL ,0
21359,RELAX LARGE WOOD LETTERS,0
21397,BLUE POLKADOT EGG CUP ,0
21627,ELEPHANT CARNIVAL POUFFE,0
21632,VINTAGE PINK DECORATIVE PARASOL,0
22106,MIRROR MOSAIC HURRICANE LAMP ,0
22108,PING! MICROWAVE PLATE,0
22221,CAKE STAND LOVEBIRD 2 TIER PINK,1
22223,CAKE PLATE LOVEBIRD PINK,0
22282,12 EGG HOUSE PAINTED WOOD,0
22329,ROUND CONTAINER SET OF 5 RETROSPOT,0
22416,SET OF 36 DOILIES SPACEBOY DESIGN ,0
22613,PACK OF 20 SPACEBOY NAPKINS,0
35648,VINTAGE BEAD PINK PURSE ,0
35651,VINTAGE BEAD PINK SCARF ,0
37447,CERAMIC CAKE DESIGN SPOTTED PLATE,0
46118,FUNKY MONKEY CUSHION COVER,0
46776C,WOVEN FROST CUSHION COVER,0
46776E,WOVEN CANDY CUSHION COVER ,0
62094B,TURQ ICE CREAM BUM BAG ,0
84078A,SET/4 WHITE RETRO STORAGE CUBES ,0
84228,HEN HOUSE W CHICK STANDING,0
84568,GIRLS ALPHABET IRON ON PATCHES ,0
84789,ENCHANTED BIRD PLANT CAGE,0
84813,SET OF 4 DIAMOND NAPKIN RINGS,0
85093,CANDY SPOT EGG WARMER HARE,0
85096,HILDA CANDY SPOT RABBIT,0
85202,HANGING WOOD AND FELT HEART,0
85204,HANGING WOOD AND FELT FLOWER,0
90001D,ANTIQUE OLIVE GREEN FLOWER EARRINGS,0
90013C,GREEN VINTAGE EARRINGS ,0
90014B,GOLD M PEARL  ORBIT NECKLACE,0
90085,CRYSTAL STILETTO PHONE CHARM,0
90132,LIGHT TOPAZ TEAL/AQUA COL NECKLACE,0
90140,PINK SWEETIE NECKLACE,0
90141B,IVORY PENDANT TRIPLE SHELL NECKLACE,0
90158,ST TROPEZ NECKLACE,0
90183A,AMBER DROP EARRINGS W LONG BEADS,0
90183B,AMETHYST DROP EARRINGS W LONG BEADS,0
90201B,BLACK ENAMEL FLOWER RING,0
90212B,JET BLACK LAS VEGAS BRACELET ROUND,0
84712B,PINK JEWELLED PHOTO FRAME,0
22279,POCKET BAG BLUE PAISLEY RED SPOT,0
22280,POCKET BAG PINK PAISELY BROWN SPOT,0
22377,BOTTLE BAG RETROSPOT ,0
22495,SET OF 2 ROUND TINS CAMEMBERT ,0
22521,CHILDS GARDEN TROWEL PINK,0
22523,CHILDS GARDEN FORK PINK,0
22677,FRENCH BLUE METAL DOOR SIGN 2,0
22682,FRENCH BLUE METAL DOOR SIGN 7,0
22715,CARD WEDDING DAY,0
21253,SET OF PICTURE FRAME  STICKERS,0
21265,PINK GOOSE FEATHER TREE 60CM,0
21389,IVORY HANGING DECORATION  BIRD,0
21391,FRENCH LAVENDER SCENT HEART,0
21403,BLUE EGG  SPOON,0
21534,DAIRY MAID LARGE MILK JUG,0
21618,4 WILDFLOWER BOTANICAL CANDLES,0
21812,GARLAND WITH HEARTS AND BELLS,0
21847,GREEN  DIAMANTE PEN IN GIFT BOX,0
21943,CAKES AND RABBITS DESIGN FLANNEL ,0
22104,MIRROR MOSAIC CANDLE PLATE,0
22322,BIRD DECORATION GREEN POLKADOT,0
22340,NOEL GARLAND PAINTED ZINC ,0
35833G,4 GOLD FLOCK CHRISTMAS BALLS,0
35916A,YELLOW FELT HANGING HEART W FLOWER,1
46776A,WOVEN BUBBLE GUM CUSHION COVER,0
72351B,SET/6 PINK  BUTTERFLY T-LIGHTS,0
84459A,PINK METAL CHICKEN HEART ,0
84637,KITCHEN FLOWER POTS WALL PLAQUE,0
85039B,S/4 IVORY MINI ROSE CANDLE IN BOWL,0
85039C,S/4 BLACK MINI ROSE CANDLE IN BOWL,0
85131C,BEADED CRYSTAL HEART BLUE ON STICK,0
90010E,AMBER GLASS/SILVER BRACELET,0
90039C,FIRE POLISHED GLASS BRACELET BLACK,0
90056,CHUNKY CRACKED GLAZE NECKLACE IVORY,0
90081C,LILY BROOCH OLIVE COLOUR,0
90101,WHITE FRANGIPANI NECKLACE,0
90130B,TURQ STONE/CRYSTAL EARRINGS,0
90130C,GREEN STONE/CRYSTAL EARRINGS,0
15044C,PURPLE PAPER PARASOL,0
20762,GREEN FERN SKETCHBOOK ,0
20803,SMALL PINK GLASS SUNDAE DISH,0
18007,ESSENTIAL BALM 3.5g TIN IN ENVELOPE,0
21720,CAKE SHOP  STICKER SHEET,0
22952,72 CAKE CASES VINTAGE CHRISTMAS,0
84968F,SET OF 16 VINTAGE SKY BLUE CUTLERY,0
21289,LARGE STRIPES CHOCOLATE GIFT BAG,0
22606,WOODEN SKITTLES GARDEN SET,0
37479B,CUBIC MUG FLOCK BLUE ON BROWN,0
37482P,CUBIC MUG PINK POLKADOT,0
20903,VINTAGE KEEPSAKE BOX TRAVELOGUE,0
20897,VINTAGE NOTEBOOK PARIS DAYS,0
71403,"PINK/WHITE ""KEEP CLEAN"" BULLET BIN",0
22683,FRENCH BLUE METAL DOOR SIGN 8,0
22685,FRENCH BLUE METAL DOOR SIGN 0,0
21973,SET OF 36 MUSHROOM PAPER DOILIES,0
22691,DOORMAT WELCOME SUNRISE,0
21162,TOXIC AREA  DOOR HANGER ,0
84926D,LA PALMIERA TILE COASTER,0
22233,JIGSAW RABBIT AND BIRDHOUSE,0
35400,WOODEN BOX ADVENT CALENDAR ,0
22486,PLASMATRONIC LAMP,0
72801G,4 BURGUNDY WINE DINNER CANDLES,0
84711A,SILVER OVAL SHAPE TRINKET BOX,1
16169N,WRAP BLUE RUSSIAN FOLKART,0
20769,DAISY JOURNAL ,0
35597A,DUSTY PINK CHRISTMAS TREE 30CM,0
47480,HANGING PHOTO CLIP ROPE LADDER,0
84522,PINK PARTY SUNGLASSES,0
20731,POSY CANDY BAG,0
35597B,BLACKCHRISTMAS TREE 30CM,0
84596B,SMALL DOLLY MIX DESIGN ORANGE BOWL,0
21226,POCKET MIRROR WOODLAND,0
79160,HEART SHAPE WIRELESS DOORBELL,0
72131,COLUMBIAN CANDLE RECTANGLE,0
21089,SET/6 GREEN SPRING PAPER CUPS,0
21647,ASSORTED TUTTI FRUTTI LARGE PURSE,0
72122,COFFEE SCENT PILLAR CANDLE,0
