StockCode,Description,cluster
84912A,PINK ROSE WASHBAG,1
85036A,GARDENIA 1 WICK MORRIS BOXED CANDLE,1
21692,SILVER LATTICE VANILLA CANDLE POT,1
84569A,PACK 3 IRON ON DOG PATCHES,1
20775,DAISY NOTEBOOK ,1
90179C,BLACK FINE BEAD NECKLACE W TASSEL,0
90060D,FIRE POLISHED GLASS NECKL BRONZE,1
85020,ROUND PINK HEART MIRROR,1
20861,GOLD COSMETIC BAG PINK STAR,1
21827,EIGHT PIECE CREEPY CRAWLIE SET,1
79051A,SMOKEY GREY COLOUR D.O.F. GLASS,1
17007B,S/3 POT POURI CUSHIONS BLUE COLOURS,1
22700,BLACK AND WHITE DOG BOWL,1
10124A,SPOTS ON RED BOOKCOVER TAPE,1
21644,ASSORTED TUTTI FRUTTI HEART BOX,0
46000P,POLYESTER FILLER PAD 65CMx65CM,1
22681,FRENCH BLUE METAL DOOR SIGN 6,0
21746,SMALL RED RETROSPOT WINDMILL,1
84916,HAND TOWEL PALE BLUE W FLOWERS,1
40005B,BLUE ORGANDY ROUND LAMPSHADE W BEA,1
18094C,WHITE AND BLUE CERAMIC OIL BURNER,1
22085,PAPER CHAIN KIT SKULLS ,1
47586A,PINK FAIRY CAKE CUSHION COVER,0
46115B,GREEN POP ART MAO CUSHION COVER ,0
84975,HEART SHAPED MIRROR,1
21336,GOLD WASHBAG,1
22050,PINK PAISLEY ROSE GIFT WRAP,1
21680,WOODLAND  STICKERS,1
20819,SILVER TEDDY BEAR,1
84925F,PSYCHEDELIC WALL THERMOMETER,1
22535,MAGIC DRAWING SLATE BUNNIES ,1
84968F,check,1
84968E,check,1
16169K,WRAP FOLK ART,1
35833G,damages,1
21001,ROSE DU SUD WASHBAG ,1
21028,NINJA RABBIT BLACK,1
21171,BATHROOM METAL SIGN ,0
21204,DAISIES  HONEYCOMB GARLAND ,1
21222,SET/4 BADGES BEETLES,1
21251,DINOSAUR HEIGHT CHART STICKER SET,1
21375,LARGE CAMPHOR WOOD FIELD MUSHROOM ,1
21595,Dad's Cab Electronic Meter,1
22101,MIRROR MOSAIC VOTIVE HOLDER,1
35914,PINK CHICK EGG WARMER + EGG CUP,1
37462E,"PET MUG, GOLDFISH",1
37474,SET/4 2 TONE EGG SHAPE MIXING BOWLS,1
47481,50CM METAL STRING WITH  7 CLIPS,1
84313B,BLUE TV TRAY TABLE ,1
84422,PINK/BLUE DISC/MIRROR STRING,1
84429A,MEDIUM PINK BUDDHA HEAD ,1
84509C,SET OF 4 POLKADOT PLACEMATS ,1
84510C,SET OF 4 POLKADOT COASTERS,1
84917,WHITE HAND TOWEL WITH BUTTERFLY,1
85087,CANDY SPOT CUSHION COVER,0
85094,CANDY SPOT EGG WARMER RABBIT,1
85125,SMALL ROUND CUT GLASS CANDLESTICK,1
90013A,MIDNIGHT BLUE VINTAGE EARRINGS,1
90059A,DIAMANTE HAIR GRIP PACK/2 CRYSTAL,1
90073,VINTAGE ENAMEL & CRYSTAL EARRINGS,1
90074,BLACK DIAMOND CLUSTER NECKLACE,0
90104,PURPLE FRANGIPANI HAIRCLIP,1
90129C,GREEN GLASS TASSLE BAG CHARM,1
90129D,AMBER GLASS TASSLE BAG CHARM,1
90129E,PURPLE GLASS TASSLE BAG CHARM,1
90160C,TURQ+RED BOUDICCA LARGE BRACELET,1
90161D,ANT COPPER PINK BOUDICCA BRACELET,1
90175B,PINK GLASS CHUNKY CHARM BRACELET,1
90177D,DROP DIAMANTE EARRINGS PURPLE,0
90184C,BLACK CHUNKY BEAD BRACELET W STRAP,1
90185A,AMBER DIAMANTE EXPANDABLE RING,1
90208,PAIR OF PINK FLOWER CLUSTER SLIDE,1
15044D,RED PAPER PARASOL,1
84707A,SILVER JEWELLED MIRROR TRINKET TRAY,1
21617,4 LILY  BOTANICAL DINNER CANDLES,1
22693,GROW A FLYTRAP OR SUNFLOWER IN TIN,1
35646,VINTAGE BEAD PINK EVENING BAG,1
47574A,ENGLISH ROSE SCENTED HANGING FLOWER,0
72819,CUPID DESIGN SCENTED CANDLES,1
84665,SQUARE CHERRY BLOSSOM CABINET,0
20857,BLUE ROSE PATCH PURSE PINK BUTTERFL,1
85047,WHITE BEADED GARLAND STRING 20LIGHT,1
22679,FRENCH BLUE METAL DOOR SIGN 4,0
22520,CHILDS GARDEN TROWEL BLUE ,1
22516,CHILDS GARDEN RAKE BLUE,1
22353,LUNCH BOX WITH CUTLERY FAIRY CAKES ,0
22498,WOODEN REGATTA BUNTING,1
S,SAMPLES,1
84725,FREESTYLE CANVAS ART PICTURE,1
37479P,CUBIC MUG FLOCK PINK ON BROWN,1
AMAZONFEE,AMAZON FEE,1
17038,PORCELAIN BUDAH INCENSE HOLDER,1
84388,WISE MAN STAR SHAPE EGG PAN,1
17084J,LOVE POTION MASALA INCENSE,1
84968D,SET OF 16 VINTAGE RED CUTLERY,1
22211,WOOD STAMP SET FLOWERS,1
22903,CALENDAR FAMILY FAVOURITES,1
22026,BANQUET BIRTHDAY  CARD  ,1
37340,MULTICOLOUR SPRING FLOWER MUG,1
16052,TEATIME PUSH DOWN RUBBER,1
16219,HOUSE SHAPE PENCIL SHARPENER,1
20763,DAISY SKETCHBOOK ,1
20801,LARGE PINK GLASS SUNDAE DISH,1
20892,SET/3 TALL GLASS CANDLE HOLDER PINK,1
21316,SMALL CHUNKY GLASS ROMAN  BOWL,1
21666,RIDGED GLASS T-LIGHT HOLDER,0
22293,HANGING CHICK GREEN DECORATION,1
22608,PENS ASSORTED FUNKY JEWELED ,0
22789,T-LIGHT HOLDER SWEETHEART HANGING,0
22880,NUMBER TILE VINTAGE FONT 1,0
22883,NUMBER TILE VINTAGE FONT 4,0
22889,NUMBER TILE VINTAGE FONT No ,0
35809A,ENAMEL PINK TEA CONTAINER,1
35833P,4 PINK FLOCK CHRISTMAS BALLS,1
37500,TEA TIME TEAPOT IN GIFT BOX,1
37501,TEA TIME TEA SET IN GIFT BOX,1
79144C,PAINTED LIGHTBULB RAINBOW DESIGN,1
85130B,BEADED CRYSTAL HEART GREEN LARGE,0
85170C,SET/6 EAU DE NIL BIRD T-LIGHTS,1
90000B,MIDNIGHT BLUE COPPER FLOWER NECKLAC,1
90003B,ROSE COLOUR PAIR HEART HAIR SLIDES,1
90005A,JADE GREEN ENAMEL HAIR COMB,1
90019C,SILVER BLACK ORBIT BRACELET,1
90087,CRYSTAL SEA HORSE PHONE CHARM,0
90168,2 DAISIES HAIR COMB,1
90169,DAISY HAIR COMB,1
90187B,GREEN DROP EARRINGS W BEAD CLUSTER,0
90202C,GREEN ENAMEL FLOWER HAIR TIE,1
90210C,RED   ACRYLIC FACETED BANGLE,1
22528,GARDENERS KNEELING PAD,1
48189,DOORMAT FRIENDSHIP ,1
84989a,75 GREEN FAIRY CAKE CASES,1
15056n,EDWARDIAN PARASOL NATURAL,1
21410,COUNTRY COTTAGE  DOORSTOP GREEN,1
84559b,3D SHEET OF CAT STICKERS,1
84660c,PINK STITCHED WALL CLOCK,0
85114c,RED ENCHANTED FOREST PLACEMAT,1
85173,SET/6 FROG PRINCE T-LIGHT CANDLES,1
22513,DOORSTOP FOOTBALL DESIGN,1
72351a,SET/6 TURQUOISE BUTTERFLY T-LIGHTS,1
84510c,SET OF 4 POLKADOT COASTERS,1
84596b,SMALL DOLLY MIX DESIGN ORANGE BOWL,1
85035c,ROSE 3 WICK MORRIS BOX CANDLE,1
85119,WATERING CAN SINGLE HOOK PISTACHIO,1
85132a,CHARLIE + LOLA BISCUITS TINS,1
22875,NUMBER TILE COTTAGE GARDEN 7,0
47570b,TEA TIME TABLE CLOTH,1
84558a,3D DOG PICTURE PLAYING CARDS,0
21689,SILVER VANILLA  FLOWER CANDLE POT,1
84247E,PACK/12 XMAS FUN CARD,1
85170B,SET/6 BLACK BIRD T-LIGHT CANDLES,1
85170A,SET/6 IVORY BIRD T-LIGHT CANDLES,1
85059,FRENCH ENAMEL WATER BASIN,1
84497,BUTTONS AND STRIPES NOTEBOOK ,1
85026B,EAU DE NILE JEWELLED T-LIGHT HOLDER,0
90175D,TIGRIS EYE CHUNKY CHARM BRACELET,1
22512,DOORSTOP RACING CAR DESIGN,1
22611,VINTAGE UNION JACK SHOPPING BAG,1
22873,NUMBER TILE COTTAGE GARDEN 5,0
37467,PIG MUG IN TWO COLOUR DESIGNS,1
84251B,"GREETING CARD, STICKY GORDON",1
84927D,LA PALMIERA TILE HOOK,1
85040A,S/4 PINK FLOWER CANDLES IN BOWL,1
85213,MINI  ZINC GARDEN DECORATIONS ,1
90001C,ANTIQUE OPAL WHITE FLOWER EARRINGS,1
90019A,SILVER M.O.P ORBIT BRACELET,1
90023,FILIGREE DIAMANTE EARRINGS,1
90027A,GLASS BEAD HOOP EARRINGS BLACK,1
90170,DAISY HAIR BAND,1
90186B,CRYSTAL HOOP EARRING FLORAL LEAF,1
90198A,VINTAGE ROSE BEAD BRACELET RASPBERR,1
90211B,JET BLACK LAS VEGAS NECKLACE 45CM,0
90214K,"LETTER ""K"" BLING KEY RING",1
90214P,"LETTER ""P"" BLING KEY RING",1
90214Z,"LETTER ""Z"" BLING KEY RING",1
20663,QUEEN OF THE SKIES HOLIDAY PURSE ,1
20794,BLUE  TILE HOOK,1
21269,ANTIQUE CREAM CUTLERY SHELF ,1
21792,CLASSIC FRENCH STYLE BASKET GREEN ,1
90212C,PURPLE LAS VEGAS BRACELET ROUND,1
22708,WRAP DOLLY GIRL,0
22048,BIRTHDAY BANQUET GIFT WRAP,1
22057,CERAMIC PLATE STRAWBERRY DESIGN,1
22930,BAKING MOULD HEART MILK CHOCOLATE,1
22931,BAKING MOULD HEART WHITE CHOCOLATE,1
22932,BAKING MOULD TOFFEE CUP CHOCOLATE,1
22937,BAKING MOULD CHOCOLATE CUPCAKES,1
22710,WRAP I LOVE LONDON ,1
22051,BLUE SCANDINAVIAN PAISLEY WRAP,1
22936,BAKING MOULD ROSE WHITE CHOCOLATE,1
22935,BAKING MOULD ROSE MILK CHOCOLATE,1
21275,ZINC TOP  2 DOOR WOODEN SHELF ,1
85068,CREAM SWEETHEART SHELF + HOOKS,1
47348A,FUSCHIA VOILE POINTY SHOE DEC,1
21686,MEDINA STAMPED METAL STOOL,1
85024C,PINK SMALL JEWELLED PHOTOFRAME,1
71038,WHITE HANGING BEADS CANDLE HOLDER,1
84613C,BLUE NEW BAROQUE FLOCK CANDLESTICK,1
84910A,PINK PAISLEY CUSHION COVER ,0
21246,RED RETROSPOT BIG BOWL,1
21376,LARGE  TALL CAMPHOR WOOD TOADSTOOL ,1
20618,QUEEN OF THE SKIES PASSPORT COVER ,0
16202E,BLACK PHOTO ALBUM ,1
47420,ASSORTED COLOUR SUCTION CUP HOOK,1
22510,GINGHAM BABUSHKA DOORSTOP,1
48116,DOORMAT MULTICOLOUR STRIPE,1
72709,IVORY SCULPTED RND CANDLE ,1
72132,COLUMBIAN CUBE CANDLE,1
85118,HEART T-LIGHT HOLDER,0
35968,FOLK ART METAL HEART T-LIGHT HOLDER,0
22063,CERAMIC BOWL WITH STRAWBERRY DESIGN,1
90184B,AMETHYST CHUNKY BEAD BRACELET W STR,1
90184A,AMBER CHUNKY BEAD BRACELET W STRAP,1
84415B,BLUE FLOCK CUSHION COVER ,0
20906,VINTAGE NOTEBOOK BEAUTY GIRL,1
20703,BLUE PADDED SOFT MOBILE,1
71495B,CD WALL TIDY RED FLOWERS,1
78124,MAGAZINE RACK GEBRA ASSORTED ,1
79403,FROSTED WHITE BASE ,1
84251G,"GREETING CARD, OVERCROWDED POOL.",1
90034,WHITE SILVER NECKLACE SHELL GLASS,0
90040C,MURANO STYLE GLASS BRACELET GOLD,1
90059D,DIAMANTE HAIR GRIP PACK/2 PERIDOT,1
90089,PINK CRYSTAL SKULL PHONE CHARM,1
90120A,PINK MURANO TWIST BRACELET,0
90201D,GREEN ENAMEL FLOWER RING,1
17013D,ORIGAMI ROSE INCENSE IN TUBE,1
17096,ASSORTED LAQUERED INCENSE HOLDERS,1
21285,RETROSPOT CANDLE  MEDIUM,1
21442,GREEN BIRDHOUSE DECORATION,1
21717,EASTER TIN BUCKET,1
21749,LARGE RED RETROSPOT WINDMILL,1
21750,LARGE SKULL WINDMILL,1
22538,MINI JIGSAW GO TO THE FAIR,1
22541,MINI JIGSAW LEAP FROG,1
22647,CERAMIC LOVE HEART MONEY BANK,1
22145,CHRISTMAS CRAFT HEART STOCKING ,1
22138,BAKING SET 9 PIECE RETROSPOT ,1
85230G,ORANGE VOTIVE CANDLE,1
71215,METAL BASE FOR CANDLES,1
20695,FLORAL BLUE MONSTER,1
22820,GIFT BAG BIRTHDAY,1
84952A,CLEAR LOVE BIRD T-LIGHT HOLDER,0
84706D,CHERRY BLOSSOM TABLE CLOCK ,1
22828,REGENCY MIRROR WITH SHUTTERS,1
22703,PINK CAT BOWL,1
84247L,FAWN AND MUSHROOM GREETING CARD,1
22937,BAKING MOULD CHOCOLATE CUP CAKES,1
22698,PINK REGENCY TEACUP AND SAUCER,1
84875B,GREEN SQUARE COMPACT MIRROR,1
84876D,BLUE HEART COMPACT MIRROR,1
84192,ASSORTED COLOUR METAL CAT ,0
21628,TRIANGULAR POUFFE VINTAGE ,1
22254,FELT TOADSTOOL LARGE,1
21615,4 LAVENDER BOTANICAL DINNER CANDLES,1
22236,CAKE STAND 3 TIER MAGIC GARDEN,1
22933,BAKING MOULD EASTER EGG MILK CHOC,1
85107,CUT GLASS T-LIGHT HOLDER OCTAGON,0
21382,SET/4 SPRING FLOWER DECORATION,1
44235,ASS COL CIRCLE MOBILE ,1
40003,WHITE BAMBOO RIBS LAMPSHADE,1
79190B,RETRO PLASTIC POLKA TRAY,1
90036D,"FLOWER GLASS GARLAND NECKL.36""BLACK",1
21535,RED RETROSPOT SMALL MILK JUG,1
21120,*Boombox Ipod Classic,1
21264,WHITE GOOSE FEATHER TREE 60CM ,1
21284,RETROSPOT CANDLE  SMALL,1
22201,FRYING PAN BLUE POLKADOT,1
22269,EGG CUP NATURAL CHICKEN,1
22526,WHEELBARROW FOR CHILDREN ,1
84012,MAGIC SHEEP WOOL GROWING FROM PAPER,1
85180B,PINK HEARTS LIGHT CHAIN ,1
90030B,RED KUKUI COCONUT SEED NECKLACE,0
90030C,BROWN KUKUI COCONUT SEED NECKLACE,0
90039B,FIRE POLISHED GLASS BRACELET MONTAN,1
90039D,FIRE POLISHED GLASS BRACELET GREEN,1
90093,CLEAR CRYSTAL STAR PHONE CHARM,1
90128A,PINK LEAVES AND BEADS PHONE CHARM,1
90128C,GREEN LEAVES AND BEADS PHONE CHARM,1
90128D,PURPLE LEAVES AND BEADS PHONE CHAR,1
90161C,ANT COPPER LIME BOUDICCA BRACELET,1
90174,BUTTERFLY HAIR BAND,1
90188,DROP EARRINGS W FLOWER & LEAF,0
90214O,"LETTER ""O"" BLING KEY RING",1
DCGS0076,SUNJAR LED NIGHT NIGHT LIGHT,1
22423,faulty,1
16015,MEDIUM CHINESE STYLE SCISSOR,1
16008,SMALL FOLDING SCISSOR(POINTED EDGE),1
37444B,BLUE BREAKFAST CUP AND SAUCER ,1
37333,"RETRO ""TEA FOR ONE"" ",1
20778,GARDEN PATH NOTEBOOK ,1
20758,ABSTRACT CIRCLES POCKET BOOK,1
22319,HAIRCLIPS FORTIES FABRIC ASSORTED,1
22824,3 TIER SWEETHEART GARDEN SHELF,1
21132,SILVER STANDING GNOME   ,1
84818,DANISH ROSE PHOTO FRAME,1
84798A,PINK FOXGLOVE ARTIIFCIAL FLOWER,1
22230,JIGSAW TREE WITH WATERING CAN,1
90033,IVORY SHELL HEART EARRINGS,1
84843,WHITE SOAP RACK WITH 2 BOTTLES,1
85032A,ROMANTIC IMAGES GIFT WRAP SET,1
85032C,CURIOUS IMAGES GIFT WRAP SET,1
35809a,ENAMEL PINK TEA CONTAINER,1
79066k,RETRO MOD TRAY,1
84536b,FAIRY CAKES NOTEBOOK A7 SIZE,1
84968a,SET OF 16 VINTAGE ROSE CUTLERY,1
21144,PINK POODLE HANGING DECORATION ,1
21317,GLASS SPHERE CANDLE STAND MEDIUM,1
72815,3 WICK CHRISTMAS BRIAR CANDLE ,1
84510a,SET OF 4 ENGLISH ROSE COASTERS,0
84968e,SET OF 16 VINTAGE BLACK CUTLERY,1
85035a,GARDENIA 3 WICK MORRIS BOXED CANDLE,1
22885,NUMBER TILE VINTAGE FONT 6 ,0
84660b,BLACK STITCHED WALL CLOCK,0
84356,POMPOM CURTAIN,1
47578A,ENGLISH ROSE SMALL SCENTED FLOWER,0
46000S,Dotcom sales,1
46000M,Dotcom sales,1
21562,HAWAIIAN GRASS SKIRT ,1
22856,ASSORTED EASTER DECORATIONS  BELLS,1
22934,BAKING MOULD EASTER EGG WHITE CHOC,1
16048,TEATIME ROUND PENCIL SHARPENER ,1
20932,PINK POT PLANT CANDLE,1
22263,FELT EGG COSY LADYBIRD ,1
46776F,WOVEN ROSE GARDEN CUSHION COVER ,0
84509E,SET OF 4 CAROUSEL PLACEMATS ,1
84510E,SET OF 4 GREEN CAROUSEL COASTERS,1
84748,FOLK FELT HANGING MULTICOL GARLAND,1
90070,RUBY GLASS CLUSTER BRACELET,1
90147,CHUNKY SILVER NECKLACE PASTEL FLOWE,0
90201C,RED ENAMEL FLOWER RING,1
37475,SET/4 COLOURFUL MIXING BOWLS,1
84951A,SET OF 4 PISTACHIO LOVEBIRD COASTER,1
84951B,SET OF 4 BLACK LOVEBIRD COASTERS,1
22053,EMPIRE DESIGN ROSETTE,1
21131,GOLD STANDING GNOME,1
20654,FIRST CLASS LUGGAGE TAG ,0
17165D,ASS COL LARGE SAND FROG P'WEIGHT,1
22291,HANGING CHICK CREAM DECORATION,1
15058A,BLUE POLKADOT GARDEN PARASOL,1
20868,SILVER FABRIC MIRROR,1
84820,DANISH ROSE TRINKET TRAYS,1
85006,SET 4 NURSERY DES ROUND BOXES,1
84821,DANISH ROSE DELUXE COASTER,1
84638,SMALL KITCHEN FLOWER POTS PLAQUE,1
22229,BUNNY WOODEN PAINTED WITH FLOWER ,1
22228,BUNNY WOODEN PAINTED WITH BIRD ,1
16169P,WRAP GREEN RUSSIAN FOLKART ,1
16054,POPART RECT PENCIL SHARPENER ASST,1
84595E,LARGE TORTILLA DESIGN RED BOWL,1
35915B,BLUE KNITTED HEN ,1
85086A,CANDY SPOT HEART DECORATION,1
85084,HOLLY TOP CHRISTMAS STOCKING,1
81950V,FLOWER PURPLE CLOCK W/SUCKER,0
22055,MINI CAKE STAND  HANGING STRAWBERY,1
84631,FRUIT TREE AND BIRDS WALL PLAQUE,1
84799,SPRIG LAVENDER ARTIFICIAL FLOWER,1
35004P,SET OF 3 PINK FLYING DUCKS,1
21454,PAINTED PINK RABBIT ,1
15058B,PINK POLKADOT GARDEN PARASOL,1
22391,PAPERWEIGHT HOME SWEET HOME,0
21318,GLASS CHALICE BLUE SMALL ,1
21418,STARFISH SOAP DISH,1
21420,OYSTER TRINKET BOX,1
22286,"DECORATION , WOBBLY RABBIT , METAL ",1
22287,"DECORATION , WOBBLY CHICKEN, METAL ",1
35609A,PINK FEATHER CHRISTMAS DECORATION,1
35610C,WHITE CHRISTMAS FLOCK DROPLET ,1
46776D,WOVEN SUNSET CUSHION COVER ,0
84688,BEACH HUT DESIGN BLACKBOARD,1
84931A,PINK SCOTTIE DOG W FLOWER PATTERN,1
84968E,SET OF 16 VINTAGE BLACK CUTLERY,1
85211,S/4 GROOVY CAT MAGNETS,1
90031,BILI NUT AND WOOD NECKLACE,0
90040A,MURANO STYLE GLASS BRACELET RED,1
90125B,AQUA BERTIE GLASS BEAD BAG CHARM,1
90125D,PURPLE BERTIE GLASS BEAD BAG CHARM,1
DCGS0003,BOXED GLASS ASHTRAY,1
85230E,STRAWBRY SCENTED VOTIVE CANDLE,1
22826,LOVE SEAT ANTIQUE WHITE METAL,1
22852,DOG BOWL VINTAGE CREAM,1
22102,MIRROR MOSAIC T-LIGHT HOLDER ,0
16033,MINI HIGHLIGHTER PENS,1
20830,SILVER PHOTO FRAME,1
20831,GOLD PHOTO FRAME,1
90003D,CRYSTAL PAIR HEART HAIR SLIDES,0
90067A,PINK VINTAGE VICTORIAN EARRINGS,1
21378,SMALL TALL CAMPHOR WOOD TOADSTOOL,1
85032B,BLOSSOM IMAGES GIFT WRAP SET,1
22857,ASSORTED EASTER GIFT TAGS,1
22858,EASTER TIN KEEPSAKE,1
22861,EASTER TIN CHICKS IN GARDEN,1
22232,JIGSAW TOADSTOOLS 3 PIECE,1
20793,BLUE TILED TRAY,1
20664,TROPICAL HOLIDAY PURSE ,1
47593A,CAROUSEL PONIES BABY BIB,1
20670,VIP HOLIDAY PURSE,1
21946,PARTY TIME DESIGN FLANNEL,1
20666,ECONOMY HOLIDAY PURSE,1
82605,OLD DOC RUSSEL METAL SIGN,0
85136B,BLUE SHARK HELICOPTER,1
84882,GREEN WIRE STANDING CANDLE HOLDER,1
85031A,ROMANTIC IMAGES SCRAP BOOK SET,1
16216,LETTER SHAPE PENCIL SHARPENER,1
84660B,BLACK STITCHED WALL CLOCK,0
21248,DOOR HANGER  MUM + DADS ROOM,1
21736,GOLD SCROLL GLASS T-LIGHT HOLDER,0
84922,PINK BUTTERFLY WASHBAG,1
90036E,"FLOWER GLASS GARLD NECKL36""AMETHYST",1
90160A,PURPLE BOUDICCA LARGE BRACELET,1
90160B,RED BOUDICCA LARGE BRACELET,1
90160D,PINK BOUDICCA LARGE BRACELET,1
82011A,"BATHROOM SCALES, TROPICAL BEACH",1
85183A,CHARLIE & LOLA WASTEPAPER BIN BLUE,0
21194,PINK  HONEYCOMB PAPER FAN,1
21972,SET OF 36 DINOSAUR PAPER DOILIES,1
22281,EASTER TREE YELLOW BIRDS,1
22887,NUMBER TILE VINTAGE FONT 8,0
84876B,GREEN HEART COMPACT MIRROR,1
90126A,PINK BERTIE MOBILE PHONE CHARM,1
90190B,GOLD/AMBER DROP EARRINGS W LEAF,0
35610B,BLACK CHRISTMAS FLOCK DROPLET ,1
84927E,FLOWERS TILE HOOK,1
84816,DANISH ROSE BEDSIDE CABINET,1
90120D,WHITE MURANO TWIST BRACELET,1
22289,HANGING METAL CHICKEN DECORATION,1
20704,MR ROBOT SOFT TOY,1
20818,GOLD TEDDY BEAR,1
21199,PINK  HEART CONFETTI IN TUBE,1
21293,MIRRORED DOVE WALL DECORATION,1
71495A,CD WALL TIDY BLUE OFFICE,0
84584,PINK GINGHAM CAT WITH SCARF,1
85179C,PINK BITTY LIGHT CHAIN,1
85188B,PINK METAL SWINGING BUNNY,1
90076,MONTANA DIAMOND CLUSTER EARRINGS,1
90164A,PINK ROSEBUD PEARL BRACELET,1
90164B,WHITE  ROSEBUD PEARL BRACELET,1
72780,BLACK SILOUETTE CANDLE PLATE,1
22954,HEN PARTY CORDON BARRIER TAPE,1
22047,EMPIRE GIFT WRAP,0
22214,CANDLE PLATE LACE WHITE,1
90162C,ANT SILVER FUSCHIA BOUDICCA RING,1
90078,PINK/WHITE GLASS DEMI CHOKER,1
90032,IVORY SHELL HEART NECKLACE,1
21331,MOROCCAN BEATEN METAL DISH LARGE,1
20848,ZINC HEART LATTICE CHARGER SMALL,1
20826,SILVER APERITIF GLASS,1
21145,ANTIQUE GLASS PLACE SETTING,1
22723,SET OF 6 HERB TINS SKETCHBOOK,1
22722,SET OF 6 SPICE TINS PANTRY DESIGN,1
22720,SET OF 3 CAKE TINS PANTRY DESIGN ,1
84575A,PINK DOG CANNISTER,1
84313C,ORANGE TV TRAY TABLE ,1
21473,SWEETHEART CREAM STEEL TABLE RECT,1
90210A,GREY ACRYLIC FACETED BANGLE,1
21109,LARGE CAKE TOWEL CHOCOLATE SPOTS,1
84823,DANISH ROSE FOLDING CHAIR,1
90057,DIAMANTE RING ASSORTED IN BOX.,1
90210D,PURPLE ACRYLIC FACETED BANGLE,1
22656,VINTAGE BLUE KITCHEN CABINET,1
22782,SET 3 WICKER STORAGE BASKETS ,1
84766,SILVER ROCOCO CANDLE STICK,1
20860,GOLD COSMETICS BAG WITH BUTTERFLY,1
84711B,PINK OVAL SHAPE TRINKET BOX,1
84817,DANISH ROSE DECORATIVE PLATE,1
35832,WOOLLY HAT SOCK GLOVE ADVENT STRING,1
22932,BAKING MOULD TOFFEE CUP  CHOCOLATE,1
22937,BAKING MOULD CUPCAKE CHOCOLATE,1
22721,SET OF 3 CAKE TINS SKETCHBOOK,1
22711,WRAP CIRCUS PARADE,0
22522,CHILDS GARDEN FORK BLUE ,1
22270,HAPPY EASTER HANGING DECORATION,1
85195,HANGING HEART BASKET,1
85194L,HANGING SPRING FLOWER EGG LARGE,1
84660A,WHITE STITCHED WALL CLOCK,0
75178,ASSTD COL BUTTERFLY/CRYSTAL W/CHIME,1
75011,BLUE DAISY MOBILE,1
47503A,ASS FLORAL PRINT MULTI SCREWDRIVER,1
22888,NUMBER TILE VINTAGE FONT 9 ,0
22886,NUMBER TILE VINTAGE FONT 7,0
22881,NUMBER TILE VINTAGE FONT 2,0
22879,NUMBER TILE VINTAGE FONT 0,0
21631,HIPPY CHIC DECORATIVE PARASOL,1
20705,MRS ROBOT SOFT TOY,1
90125A,PINK BERTIE GLASS BEAD BAG CHARM,1
85180A,RED HEARTS LIGHT CHAIN ,1
85159B,"WHITE TEA,COFFEE,SUGAR JARS",1
22963,JAM JAR WITH BLUE LID,1
22204,MILK PAN BLUE POLKADOT,1
90058B,CRYSTAL STUD EARRINGS ASSORTED COL ,0
84597B,RETRO BROWN BALL ASHTRAY ,1
84616,SILVER ROCCOCO CHANDELIER,1
84666,SQUARE CHERRY BLOSSOM CABINET,0
22734,amazon sales,1
22303,COFFEE MUG APPLES DESIGN,1
84796a,PINK HAWAIIAN PICNIC HAMPER FOR 2,1
20871,OPULENT VELVET SET/3 CANDLES,1
21160,KEEP OUT GIRLS DOOR HANGER ,1
21186,WHITE DOVE HONEYCOMB PAPER GARLAND,1
72801d,4 SKY BLUE DINNER CANDLES,1
85114a,BLACK ENCHANTED FOREST PLACEMAT,1
84673A,PINK FLY SWAT,1
37503,TEA TIME CAKE STAND IN GIFT BOX,1
21386,IVORY HANGING DECORATION  EGG,1
90146,FINE SILVER NECKLACE W PASTEL FLOWE,0
22257,FELT FARM ANIMAL SHEEP,1
22258,FELT FARM ANIMAL RABBIT,1
22259,FELT FARM ANIMAL HEN,1
35817P,"ACRYLIC JEWEL SNOWFLAKE,PINK",1
85141,JARDIN ETCHED GLASS FRUITBOWL,1
90042A,FRESHWATER PEARL BRACELET GOLD,1
90136,PALE PINK/AMETHYST STONE NECKLACE,0
90060B,FIRE POLISHED GLASS NECKL GOLD,1
90035A,"PEARL & SHELL 42""NECKL. GREEN",1
90133,TEAL/FUSCHIA COL BEAD NECKLACE,0
90179A,AMBER FINE BEAD NECKLACE W TASSEL,0
79329,PINK FLOCK GLASS CANDLEHOLDER,1
85146,JARDIN ETCHED GLASS SMALL BELL JAR,1
22033,BOTANICAL ROSE GREETING CARD,1
22032,BOTANICAL LILY GREETING CARD,1
84751B,BLACK MEDIUM GLASS CAKE STAND,1
84507B,STRIPES DESIGN MONKEY DOLL,0
84620,BLUE GINGHAM ROSE CUSHION COVER,0
84929,ASSTD FRUIT+FLOWERS FRIDGE MAGNETS,1
21707,FOLDING UMBRELLA BLACKBLUE POLKADOT,1
22868,NUMBER TILE COTTAGE GARDEN 0 ,0
22874,NUMBER TILE COTTAGE GARDEN 6,0
22872,NUMBER TILE COTTAGE GARDEN 4,0
22871,NUMBER TILE COTTAGE GARDEN 3 ,0
22302,COFFEE MUG PEARS  DESIGN,1
47594B,SCOTTIES DESIGN WASHBAG,1
21196,ROUND WHITE CONFETTI IN TUBE,1
22218,CAKE STAND LACE WHITE,1
22970,LONDON BUS COFFEE MUG,1
22062,CERAMIC BOWL WITH LOVE HEART DESIGN,1
22040,BOTANICAL ROSE GIFT WRAP,1
21348,PINK SPOTS CHOCOLATE NESTING BOXES ,1
22971,QUEENS GUARD COFFEE MUG,1
84877B,GREEN ROUND COMPACT MIRROR,1
84926F,PSYCHEDELIC TILE COASTER,1
21400,RED PUDDING SPOON,1
35911A,MULTICOLOUR RABBIT EGG WARMER,1
85031C,CURIOUS IMAGES SCRAP BOOK SET,1
84613A,PINK NEW BAROQUE FLOCK CANDLESTICK,1
90012B,BLACK DROP CRYSTAL NECKLACE,0
21043,APRON MODERN VINTAGE COTTON,1
37342,POLKADOT COFFEE CUP & SAUCER PINK,1
84750B,BLACK SMALL GLASS CAKE STAND,1
21425,SKULLS STORAGE BOX LARGE,1
72800C,4 PINK DINNER CANDLE SILVER FLOCK,1
35810A,ENAMEL PINK COFFEE CONTAINER,1
21491,SET OF THREE VINTAGE GIFT WRAPS,1
21633,SUNFLOWER DECORATIVE PARASOL,1
35607A,PINK FLUFFY CHRISTMAS DECORATION,1
22410,MONEY BOX HOUSEKEEPING DESIGN,1
84859A,SILVER DISCO HANDBAG,1
85103,SILVER T-LIGHT SETTING,0
85031B,BLOSSOM IMAGES SCRAP BOOK SET,1
22249,DECORATION WHITE CHICK MAGIC GARDEN,1
22407,MONEY BOX FIRST ADE DESIGN,1
85205B,PINK FELT EASTER RABBIT GARLAND,1
22929,SCHOOL DESK AND CHAIR ,1
85163A,WHITE BAROQUE WALL CLOCK ,0
85163B,BLACK BAROQUE WALL CLOCK ,0
85088,CANDY SPOT HAND BAG,1
90201A,PURPLE ENAMEL FLOWER RING,1
90202A,PURPLE ENAMEL FLOWER HAIR TIE,1
90206A,GOLD DIAMANTE STAR BROOCH,1
22285,HANGING HEN ON NEST DECORATION,1
84600,NEW BAROQUE JEWELLERY BOX ,1
84857C,PINK MONTE CARLO HANDBAG,1
90144,SILVER DROP EARRINGS WITH FLOWER,0
90165B,WHITE ROSEBUD  PEARL EARRINGS,1
20694,FLORAL PINK MONSTER,1
20869,GOLD FABRIC MIRROR,1
20954,*USB Office Mirror Ball,1
21455,PAINTED YELLOW WOODEN DAISY,1
22206,"MUG , DOTCOMGIFTSHOP.COM ",1
35933,PINK STOCKING CHRISTMAS DECORATION,1
85232A,SET/3 POLKADOT STACKING TINS,1
90027B,GLASS BEAD HOOP EARRINGS MONTANA,1
90122A,PINK CRYSTAL+GLASS BRACELET,1
90197B,BLACK GLASS BRACELET W HEART CHARMS,1
72225C,LAVENDER SCENT CAKE CANDLE,1
46000U,POLYESTER FILLER PAD 30CMx30CM,1
90072,RUBY DROP CHANDELIER EARRINGS,0
90214T,"LETTER ""T"" BLING KEY RING",1
20934,SET/3 POT PLANT CANDLES,1
21402,RED  EGG  SPOON,1
22135,MINI LADLE LOVE HEART PINK,1
47585A,PINK FAIRY CAKE CUSHION COVER,0
90011D,PURPLE CRYSTAL DROP EARRINGS,0
90012A,MIDNIGHT BLUE DROP CRYSTAL NECKLACE,0
90042C,FRESHWATER PEARL BRACELET IVORY,1
90141C,TURQ PENDANT TRIPLE SHELL NECKLACE,0
90142A,GREEN PENDANT SHELL NECKLACE,0
90165A,PINK ROSEBUD PEARL EARRINGS,1
90177B,DROP DIAMANTE EARRINGS BLACK DIAMON,0
90202D,PINK ENAMEL FLOWER HAIR TIE,1
90154,LAZER CUT NECKLACE W PASTEL BEADS,1
90199D,5 STRAND GLASS NECKLACE AMBER,0
90014A,SILVER/MOP ORBIT NECKLACE,0
90178B,PURPLE CHUNKY GLASS+BEAD NECKLACE,0
21009,ETCHED GLASS STAR TREE DECORATION,1
21793,CLASSIC FRENCH STYLE BASKET BROWN,1
85023B,EAU DE NILE JEWELLED PHOTOFRAME,1
85109,PINK BOUDOIR T-LIGHT HOLDER,0
84804A,CREAM DELPHINIUM ARTIFICIAL FLOWER,1
84800L,LARGE WHITE/PINK ROSE ART FLOWER,1
84800M,MEDIUM WHITE/PINK ROSE ART FLOWER,1
84802A,WHITE ANEMONE ARTIFICIAL FLOWER,1
84806A,PINK CANDYSTUFT ARTIFICIAL FLOWER,1
22707,WRAP MONSTER FUN ,1
21503,TOYBOX  WRAP ,1
90108,BLUE BLOSSOM HAIR CLIP,1
16207A,PINK STRAWBERRY HANDBAG ,1
21747,SMALL SKULL WINDMILL,1
84457,SET/3 RABBITS FLOWER SKIPPPING ROPE,1
84249A,"GREETING CARD,SQUARE, DOUGHNUTS",1
22837,HOT WATER BOTTLE BABUSHKA LARGE,0
22953,BIRTHDAY BANNER TAPE,1
22148,EASTER CRAFT 4 CHICKS ,1
90011B,BLACK CRYSTAL DROP EARRINGS,0
90055,CRACKED GLAZE EARRINGS BROWN,1
90142D,MOP PENDANT SHELL NECKLACE,0
90176B,DIAMANTE NECKLACE BLACK ,1
gift_0001_40,Dotcomgiftshop Gift Voucher 40.00,1
21198,WHITE HEART CONFETTI IN TUBE,1
90027D,GLASS BEAD HOOP EARRINGS AMETHYST,1
44228,CANNABIS LEAF BEAD CURTAIN,1
85230A,OPIUM SCENTED VOTIVE CANDLE,1
79191D,RETRO PLASTIC DAISY TRAY,1
85135B,Found,0
22066,LOVE HEART TRINKET POT,1
35819B,"ACRYLIC HANGING JEWEL,BLUE",1
84199,GLOW IN DARK DOLPHINS,1
82613A,"METAL SIGN,CUPCAKE SINGLE HOOK",1
85135A,YELLOW DRAGONFLY HELICOPTER,1
22823,CHEST NATURAL WOOD 20 DRAWERS,1
DCGS0070,CAMOUFLAGE DOG COLLAR,1
15044A,PINK PAPER PARASOL ,1
85231b,CINAMMON SET OF 9 T-LIGHTS,1
85114b,IVORY ENCHANTED FOREST PLACEMAT,1
85160a,WHITE BIRD GARDEN DESIGN MUG,1
m,Manual,1
82613b,"METAL SIGN,CUPCAKE SINGLE HOOK",1
82613c,"METAL SIGN,CUPCAKE SINGLE HOOK",1
84795b,SUNSET CHECK HAMMOCK,1
85126,LARGE ROUND CUTGLASS CANDLESTICK,1
47518f,ICON PLACEMAT POP ART ELVIS,1
85035b,CHOCOLATE 3 WICK MORRIS BOX CANDLE,0
84968f,SET OF 16 VINTAGE SKY BLUE CUTLERY,1
85049g,CHOCOLATE BOX RIBBONS ,1
84499,BLACK FLOWER CANDLE PLATE,1
16045,POPART WOODEN PENCILS ASST,1
84872A,TEATIME FUNKY FLOWER BACKPACK FOR 2,1
21394,RED POLKADOT BEAKER ,1
22046,TEA PARTY  WRAPPING PAPER ,1
84931B,BLUE SCOTTIE DOG W FLOWER PATTERN,1
21270,ANTIQUE CREAM CUTLERY CUPBOARD,1
22134,MINI LADLE LOVE HEART RED ,1
85161,ACRYLIC GEOMETRIC LAMP,1
90011A,MIDNIGHT BLUE CRYSTAL DROP EARRINGS,0
90013D,PURPLE VINTAGE EARRINGS,1
90024E,NEW BAROQUE B'FLY NECKLACE MONTANA,0
90024F,NEW BAROQUE B'FLY NECKLACE CRYSTAL,0
90103,PURPLE FRANGIPANI NECKLACE,0
90152A,SILVER/NAT SHELL NECKLACE W PENDANT,0
90205C,LARGE CRYSTAL DIAMANTE HAIRSLIDE,0
22247,BUNNY DECORATION MAGIC GARDEN,1
gift_0001_50,Dotcomgiftshop Gift Voucher 50.00,1
84251C,"GREETING CARD, TWO SISTERS.",1
16206B,RED PURSE WITH PINK HEART,1
46138B,BLUE CHENILLE SHAGGY CUSHION COVER ,0
20701,PINK CAT FLORAL CUSHION COVER ,0
90112,PINK DOLLY HAIR CLIPS,1
35443,RASTA IN BATH W SPLIFF ASHTRAY,1
22501,reverse 21/5/10 adjustment,1
22502,reverse 21/5/10 adjustment,1
21661,VINTAGE GLASS TEA CADDY,1
90125E,AMBER BERTIE GLASS BEAD BAG CHARM,1
85168B,BLACK BAROQUE CARRIAGE CLOCK,0
85186C,BUNNY EGG GARLAND,1
84926E,FLOWERS TILE COASTER,1
85144,JARDIN ETCHED GLASS CHEESE DISH,1
84218,BOX/12 CHICK & EGG IN BASKET,1
85194S,HANGING SPRING FLOWER EGG SMALL,1
22268,EASTER DECORATION SITTING BUNNY,1
90037B,TINY CRYSTAL BRACELET GREEN,0
90041,PEARL AND CHERRY QUARTZ BRACLET,1
90125C,TURQUOISE BERTIE GLASS BEAD CHARM,1
90163A,PINK ROSEBUD & PEARL NECKLACE,0
90163B,WHITE ROSEBUD & PEARL NECKLACE,0
21412,VINTAGE GOLD TINSEL REEL,1
35911B,PINK/FLOWER RABBIT EGG WARMER ,1
84989A,75 GREEN FAIRY CAKE CASES,1
79071B,ENGLISH ROSE METAL WASTE BIN,0
16169M,WRAP DAISY CARPET ,1
22709,WRAP WEDDING DAY,1
gift_0001_30,Dotcomgiftshop Gift Voucher 30.00,1
gift_0001_20,Dotcomgiftshop Gift Voucher 20.00,1
79320,FLAMINGO LIGHTS,1
85042,ANTIQUE LILY FAIRY LIGHTS,1
20785,FUSCHIA RETRO BAR STOOL,1
85089,CANDY SPOT BUNNY,1
