StockCode,Description,cluster
35909A,RABBIT EASTER DECORATION,0
35910A,MULTICOLOUR EASTER RABBIT ,0
21763,VINTAGE WOODEN BAR STOOL,0
20933,YELLOW POT PLANT CANDLE,0
35972,DAISY FOLKART HEART DECORATION,0
90155,RESIN NECKLACE W PASTEL BEADS,1
47589,CONGRATULATIONS BUNTING,0
79323B,BLACK CHERRY LIGHTS,0
21645,ASSORTED TUTTI FRUTTI ROUND BOX,0
84661A,WHITE SQUARE TABLE CLOCK,0
90118,PINK DAISY BAG CHARM,0
90182C,BLACK 3 BEAD DROP EARRINGS,0
21278,VINTAGE KITCHEN PRINT PUDDINGS,0
47518F,ICON PLACEMAT POP ART ELVIS,1
16156L,"WRAP, CAROUSEL",0
47351B,BLUE  VOILE LAMPSHADE,0
21084,SET/6 COLLAGE PAPER CUPS,0
21088,SET/6 FRUIT SALAD PAPER CUPS,0
21096,SET/6 FRUIT SALAD  PAPER PLATES,0
90119,METALIC LEAVES BAG CHARMS,0
84741C,CITRUS GARLAND FELT FLOWERS ,1
22266,EASTER DECORATION HANGING BUNNY,0
22267,EASTER DECORATION EGG BUNNY ,0
21003,ROSE DU SUD CUSHION COVER,0
21757,LIGHTHOUSE PRINTED METAL SIGN,1
90123B,TURQUOISE HEART OF GLASS BRACELET,0
90123C,GREEN HEART OF GLASS BRACELET,0
90122C,TURQUOISE CRYSTAL+GLASS BRACELET,0
90156,RESIN BRACELET W PASTEL BEADS,1
85023C,PINK LARGE JEWELED PHOTOFRAME,0
84617,NEW BAROQUE BLACK BOXES,0
21332,MOROCCAN BEATEN METAL MIRROR,0
35923,CANDY HEART HANGING DECORATION,0
84661C,PINK SQUARE TABLE CLOCK,0
90038B,GLASS AND PAINTED BEADS BRACELET OL,0
90137,PINK COMBO MINI CRYSTALS NECKLACE,0
22617,"mouldy, thrown away.",1
21655,HANGING RIDGE GLASS T-LIGHT HOLDER,0
79323P,PINK CHERRY LIGHTS,0
72038P,damages,0
90181A,AMBER GLASS/SHELL/PEARL NECKLACE,0
90214W,"LETTER ""W"" BLING KEY RING",0
90059F,DIAMANTE HAIR GRIP PACK/2 LT ROSE,0
44091A,BLUE CRUSOE CHECK LAMPSHADE,0
21280,VINTAGE KITCHEN PRINT VEGETABLES,0
21644,found,0
22837,Found,0
20748,Found,0
90037C,TINY CRYSTAL BRACELET BLUE,0
90122B,JADE CRYSTAL+GLASS BRACELET,0
35915C,PEACH KNITTED HEN ,0
85197,SET OF 12 MINI BUNNIES IN A BUCKET,0
85019B,BLOSSOM  IMAGES NOTEBOOK SET,0
16207B,PINK HEART RED HANDBAG,0
20698,LITTLE PINK MONSTER SOFT TOY,0
47556B,TEA TIME TEA TOWELS ,0
35265,COLOURFUL FLOWER FRUIT BOWL,0
16162L,THE KING GIFT BAG,0
90092,BLUE CRYSTAL BOOT PHONE CHARM,0
90190A,SILVER/CRYSTAL DROP EARRINGS W LEAF,0
90011E,AMBER CRYSTAL DROP EARRINGS,0
90038A,GLASS AND PAINTED BEADS BRACELET TO,0
90079,VINTAGE ENAMEL & CRYSTAL NECKLACE,0
21667,GLASS CAKE COVER AND PLATE,0
22323,PINK POLKADOT KIDS BAG,0
22103,MIRROR MOSAIC T-LIGHT HOLDER ROUND,0
90141D,ROSE PENDANT TRIPLE SHELL NECKLACE,0
85160B,BLACK BIRD GARDEN DESIGN MUG,0
84050,counted,0
23231,WRAP DOILEY DESIGN,0
62086A,PINK RETRO BIG FLOWER BAG,0
90039A,FIRE POLISHED GLASS BRACELET RED,0
21371,MIRRORED WALL ART POPPIES,1
35912B,WHITE/PINK CHICK DECORATION,0
23230,WRAP ALPHABET DESIGN,0
85206B,PINK FELT EASTER EGG BASKET,0
85189,HANGING BUTTERFLY  EGG,0
84745A,PINK HANGING GINGHAM EASTER HEN,0
84745B,BLUE HANGING GINGHAM EASTER HEN,0
90130D,RED STONE/CRYSTAL EARRINGS,0
21117,BLOND DOLL DOORSTOP,0
21459,YELLOW EASTER EGG HUNT START POST,0
21460,GREEN EASTER EGG HUNT START POST,0
37468,HARDMAN MUG 3 ASSORTED,0
21897,POTTING SHED CANDLE CITRONELLA,0
85231g,ORANGE SCENTED SET/9 T-LIGHTS,0
72369A,PINK CLEAR GLASS CANDLE PLATE,0
22967,SET 3 SONG BIRD PAPER EGGS ASSORTED,0
22957,SET 3 PAPER VINTAGE CHICK PAPER EGG,0
22896,PEG BAG APPLE DESIGN,0
22199,FRYING PAN RED POLKADOT ,0
20914,SET/5 RED SPOTTY LID GLASS BOWLS,0
20725,LUNCH BAG RED SPOTTY,0
21082,SET/20 FRUIT SALAD PAPER NAPKINS ,0
21368,MIRRORED WALL ART LADIES,1
17174,ASSTD RASTA KEY-CHAINS,0
23233,WRAP POPPIES  DESIGN,0
35921,EASTER BUNNY HANGING GARLAND,1
85200,BUNNY EGG BOX,0
84231,EASTER BUNNY WITH BASKET ON BACK,0
21461,BLUE EASTER EGG HUNT START POST,0
84462,3 PINK HEN+CHICKS IN BASKET,0
84461,12 PINK HEN+CHICKS IN BASKET,0
35922,EASTER BUNNY WREATH,0
84675,FROG KING WATERING CAN,0
47469,ASSORTED SHAPES PHOTO CLIP SILVER ,0
23232,WRAP VINTAGE PETALS  DESIGN,0
84905,PINK BUTTERFLY CUSHION COVER ,0
84806B,WHITE CANDYSTUFT ARTIFICIAL FLOWER,1
21458,2 PICTURE BOOK EGGS EASTER BUNNY,0
85198,ASSORTED FARMYARD ANIMALS IN BUCKET,0
90191,SILVER LARIAT 40CM,0
84796B,BLUE SAVANNAH PICNIC HAMPER FOR 2,0
23166,MEDIUM CERAMIC TOP STORAGE JAR,0
20845,ZINC HEART LATTICE 2 WALL PLANTER,0
84033,FLAG OF ST GEORGE ,0
85040a,S/4 PINK FLOWER CANDLES IN BOWL,0
20795,LARGE BLUE PROVENCAL CERAMIC BALL,0
47590b,PINK HAPPY BIRTHDAY BUNTING,0
72807a,SET/3 ROSE CANDLE IN JEWELLED BOX,0
84226,HEN HOUSE W FAMILY IN BARN & NEST,0
79323W,WHITE CHERRY LIGHTS,0
21926,RED/CREAM STRIPE CUSHION COVER ,0
37379A,PINK CHERRY BLOSSOM CUP & SAUCER,0
35920,FOUR RABBIT EASTER DECORATIONS,0
84801A,PINK HYDRANGEA ART FLOWER,1
84592,CROCHET ROSE PURSE WITH SUEDE BACK,0
84800S,SMALL WHITE/PINK ROSE ART FLOWER,1
79192A,RETRO PLASTIC 70'S TRAY,0
85130C,BEADED CRYSTAL HEART BLUE  LARGE,0
20756,GREEN FERN POCKET BOOK,0
22351,Given away,0
46000S,Dotcom,0
21112,SWISS ROLL TOWEL PINK  SPOTS,0
21320,GLASS CHALICE GREEN  LARGE ,0
90027C,GLASS BEAD HOOP EARRINGS GREEN,0
90202B,WHITE ENAMEL FLOWER HAIR TIE,0
22125,UNION JACK HOT WATER BOTTLE ,1
40046A,RED DAISY PAPER LAMPSHADE,0
85188A,GREEN METAL SWINGING BUNNY,0
84527,FLAMES SUNGLASSES PINK LENSES,0
72799C,PINK PILLAR CANDLE SILVER FLOCK,0
71101E,STANDING FAIRY POLE SUPPORT ,0
21457,2 PICTURE BOOK EGGS EASTER DUCKS,0
21456,2 PICTURE BOOK EGGS EASTER CHICKS,0
35647,VINTAGE BEAD PINK SHADE ,0
84632,DECORATIVE HANGING SHELVING UNIT,0
72801c,4 ROSE PINK DINNER CANDLES,0
22597,MUSICAL ZINC HEART DECORATION ,0
22764,"RUSTIC WOODEN CABINET, GLASS DOORS",0
90037A,TINY CRYSTAL BRACELET RED,0
35913B,WHITE/PINK CHICK EASTER DECORATION,0
22146,EASTER CRAFT IVY WREATH WITH CHICK,0
21476,STEEL SWEETHEART ROUND TABLE CREAM,0
37351,ORANGE FLOWER MUG ,0
85160A,WHITE BIRD GARDEN DESIGN MUG,0
85096,label mix up,0
84997a,GREEN 3 PIECE POLKADOT CUTLERY SET,0
22595,GINGHAM HEART DECORATION,0
21344,MOROCCAN BEATEN METAL DISH,0
84974,S/2 ZINC HEART DESIGN PLANTERS,0
22602,RETROSPOT WOODEN HEART DECORATION,0
72821,CUPID SCENTED CANDLE IN GLASS,0
22596,CHRISTMAS STAR WISH LIST CHALKBOARD,0
85161,samples/damages,0
90123D,WHITE HEART OF GLASS BRACELET,1
90123A,PINK HEART OF GLASS BRACELET,0
90148,LONG SILVER NECKLACE PASTEL FLOWER,0
90016B,GOLD/M.O.P PENDANT ORBIT NECKLACE,0
90016A,SILVER/M.O.P PENDANT ORBIT NECKLACE,0
84847,FLORAL BATHROOM SET,0
20898,VINTAGE NOTEBOOK TRAVELOGUE,0
90183C,BLACK DROP EARRINGS W LONG BEADS,0
DCGS0069,OOH LA LA DOGS COLLAR,0
84465,15 PINK FLUFFY CHICKS IN BOX,0
20851,ZINC HEART LATTICE TRAY OVAL ,0
84715,SET OF 6 ICE CREAM SKITTLES,0
84919,BLUE CUSHION COVER WITH FLOWER,0
84907,PINK YELLOW PATCH CUSHION COVER,0
85024B,EAU DE NILE JEWELLED PHOTOFRAME,0
35637C,PINK STRING CURTAIN WITH POLE,0
21811,HANGING HEART WITH BELL,1
71496B,A4 WALL TIDY RED FLOWERS,0
17028J,INCENSE BAZAAR PEACH,0
17084A,TRANQUILITY MASALA INCENSE,0
84795C,OCEAN STRIPE HAMMOCK ,0
62074B,ELEPHANT CLIP W SUCTION CUP,0
84279B,CHERRY BLOSSOM DECORATIVE FLASK,0
85063,CREAM SWEETHEART MAGAZINE RACK,0
84801B,WHITE HYDRANGEA ART FLOWER,1
84805A,CREAM CLIMBING HYDRANGA ART FLOWER,1
17136A,BLUE STONES ON WIRE FOR CANDLE,0
84993a,75 GREEN PETIT FOUR CASES,0
72807b,SET/3 OCEAN SCENT CANDLE JEWEL BOX,0
84509b,SET OF 4 FAIRY CAKE PLACEMATS,0
21818,GLITTER HEART DECORATION,0
84708B,PINK JEWELLED PHOTO FRAME ,0
44089A,PINK GAUZE BUTTERFLY LAMPSHADE,0
84723,CHERRY BLOSSOM CANVAS ART PICTURE,0
22038,BOTANICAL LAVENDER GIFT WRAP ,0
90098,NECKLACE+BRACELET PINK BUTTERFLY,0
15058C,ICE CREAM DESIGN GARDEN PARASOL,0
22989,SET 2 PANTRY DESIGN TEA TOWELS,0
84968d,SET OF 16 VINTAGE RED CUTLERY,0
84509a,SET OF 4 ENGLISH ROSE PLACEMATS,0
84452,METAL RABBIT LADDER EASTER ,0
84611B,thrown away,1
84612B,thrown away,1
84613A,thrown away,1
84614A,thrown away,1
22990,COTTON APRON PANTRY DESIGN,0
85092,CANDY SPOT TEA COSY,0
37413,ICON MUG REVOLUTIONARY,0
DCGSSBOY,BOYS PARTY BAG,0
DCGSSGIRL,GIRLS PARTY BAG,0
35815P,"ACRYLIC JEWEL SNOWFLAKE, PINK",0
21228,"POCKET MIRROR ""GLAMOROUS""",0
84536a,ENGLISH ROSE NOTEBOOK A7 SIZE,0
72812,LARGE ZINC GLASS CANDLEHOLDER,0
82001s,VINYL RECORD FRAME SILVER,0
79063D,"RETRO PILL BOX , REVOLUTIONARY",0
75172,PAINTED SEA SHELL METAL WINDCHIME,0
45013,FOLDING SHOE TIDY,0
21636,MADRAS NOTEBOOK MEDIUM,0
71510,SQUARE METAL CANDLEHOLDER BASE,0
44265,M/COLOUR POM-POM CURTAIN,0
90064B,BLACK VINTAGE  CRYSTAL EARRINGS,0
90064A,WHITE VINTAGE CRYSTAL EARRINGS,0
90063A,WHITE VINT ART DECO CRYSTAL NECKLAC,0
90063B,BLACK VINT ART DEC CRYSTAL NECKLACE,0
90029,NEW BAROQUE SMALL NECKLACE BLACK,0
44089C,LILAC GAUZE BUTTERFLY LAMPSHADE,0
44236,PINK/PURPLE CIRCLE CURTAIN,0
21898,POTTING SHED ROSE CANDLE,0
82095,HEART BUTTONS JEWELLERY BOX,0
90024B,NEW BAROQUE B'FLY NECKLACE RED,0
84406B,incorrectly made-thrown away.,0
84798B,PURPLE FOXGLOVE ARTIIFCIAL FLOWER,0
84803A,PINK ALLIUM  ARTIFICIAL FLOWER,0
21681,GIANT MEDINA STAMPED METAL BOWL ,0
35909B,PINK FLOWERS RABBIT EASTER,0
90180B,PURPLE AMETHYST NECKLACE W TASSEL,0
90152C,BLUE/NAT SHELL NECKLACE W PENDANT,0
84859C,PINK DISCO HANDBAG,0
79406,FROSTED WHITE BASE ,0
22980,PANTRY SCRUBBING BRUSH,0
22993,SET OF 4 PANTRY JELLY MOULDS,0
23006,TRAVEL CARD WALLET FLOWER MEADOW,0
23004,TRAVEL CARD WALLET PANTRY,0
23002,TRAVEL CARD WALLET SKULLS,0
23003,TRAVEL CARD WALLET VINTAGE ROSE ,0
23000,TRAVEL CARD WALLET TRANSPORT,0
22994,TRAVEL CARD WALLET RETROSPOT,0
22998,TRAVEL CARD WALLET KEEP CALM,0
84596f,SMALL MARSHMALLOWS PINK BOWL,0
84596g,SMALL CHOCOLATES PINK BOWL,0
22991,GIRAFFE WOODEN RULER,0
22992,REVOLVER WOODEN RULER ,0
22999,TRAVEL CARD WALLET RETRO PETALS,0
22995,TRAVEL CARD WALLET SUKI,0
22996,TRAVEL CARD WALLET VINTAGE TICKET,0
22978,PANTRY ROLLING PIN,0
22997,TRAVEL CARD WALLET UNION JACK,0
23005,TRAVEL CARD WALLET I LOVE LONDON,0
79062D,"RETRO TIN ASHTRAY,REVOLUTIONARY",0
20837,FRENCH FLORAL CUSHION COVER ,0
47341A,FUSCHIA TABLE RUN FLOWER ,1
22351,DOTCOMGIFTSHOP TEA TOWEL,0
21087,SET/6 POSIES PAPER CUPS,0
37491D,PURPLE/BLUE CERAMIC CANDLE HOLDER,0
44092C,PURPLE/COPPER HANGING LAMPSHADE,0
84997C,CHILDRENS CUTLERY POLKADOT BLUE,0
84997D,CHILDRENS CUTLERY POLKADOT PINK,0
79331,PINK FLOCK GLASS CANDLEHOLDER,0
84306,S/3 PINK SQUARE PLANTERS ROSES,0
44092B,BLUE WHITE PLASTIC RINGS LAMPSHADE,0
90065A,WHITE VINTAGE CRYSTAL BRACELET,0
90026D,GLASS BEAD HOOP NECKLACE AMETHYST,0
90000A,RASPBERRY ANT COPPER FLOWER NECKLAC,0
90026C,GLASS BEAD HOOP NECKLACE GREEN,0
90026B,GLASS BEAD HOOP NECKLACE MONTANA,0
35638A,PINK AND BLACK STRING CURTAIN,0
84691,PACK 20 DOLLY PEGS,0
22383,LUNCH BAG SUKI DESIGN ,0
84796A,PINK HAWAIIAN PICNIC HAMPER FOR 2,0
21928,JUMBO BAG SCANDINAVIAN BLUE PAISLEY,0
84997B,CHILDRENS CUTLERY RETROSPOT RED ,0
84997A,CHILDRENS CUTLERY POLKADOT GREEN ,0
85065,CREAM SWEETHEART TRAYS,0
21414,SCALLOP SHELL SOAP DISH,0
84858C,PINK RIVIERA HANDBAG,0
84997a,CHILDRENS CUTLERY POLKADOT GREEN ,0
84997c,CHILDRENS CUTLERY POLKADOT BLUE,0
84997d,CHILDRENS CUTLERY POLKADOT PINK,0
84466,TOP SECRET PEN SET,0
84687,BEACH HUT SHELF W 3 DRAWERS,0
90100,NECKLACE+BRACELET SET PINK DAISY,0
84809B,PINK CHRYSANTHEMUMS ART FLOWER,1
84997b,CHILDRENS CUTLERY RETROSPOT RED ,0
72140E,BEST DAD CANDLE LETTERS,0
10080,GROOVY CACTUS INFLATABLE,0
17001,HEAVENS SCENT FRAGRANCE OILS ASSTD,0
71050,SMALL SINGLE FLAME CANDLE HOLDER,0
90124A,PINK MURANO TWIST NECKLACE,0
90135,ORANGE/WHT/FUSCHIA STONES NECKLACE,0
90157,RIVIERA NECKLACE,0
90176A,CLASSIC DIAMANTE NECKLACE JET,0
90176C,DIAMANTE NECKLACE,0
90177A,CLASSIC DIAMANTE EARRINGS JET,0
90187A,BLUE DROP EARRINGS W BEAD CLUSTER,0
90001A,ANTIQUE RASPBERRY FLOWER EARRINGS,0
22797,damages,0
84802B,PURPLE ANEMONE ARTIFICIAL FLOWER,0
84803B,WHITE ALLIUM  ARTIFICIAL FLOWER,1
23182,TOILET SIGN OCCUPIED OR VACANT,0
20796,SMALL BLUE PROVENCAL CERAMIC BALL,0
22979,PANTRY WASHING UP BRUSH,0
21769,showroom,0
23177,TREASURE ISLAND BOOK BOX,0
23193,BUFFALO BILL TREASURE BOOK BOX,0
23194,GYMKHANNA TREASURE BOOK BOX,0
23176,ABC TREASURE BOOK BOX ,0
22982,PANTRY PASTRY BRUSH,0
23126,DOLLCRAFT GIRL AMELIE KIT,0
23127,DOLLCRAFT GIRL NICOLE,0
16020C,CLEAR STATIONERY BOX SET ,0
90016C,SILVER/BLACK PENDANT ORBIT NECKLACE,0
90025D,BAROQUE BUTTERFLY EARRINGS PINK,0
23127,FELTCRAFT GIRL NICOLE KIT,0
23128,FELTCRAFT BOY JEAN-PAUL KIT,0
23126,FELTCRAFT GIRL AMELIE KIT,0
23194,GYMKHANA TREASURE BOOK BOX,0
23183,MOTHER'S KITCHEN SPOON REST ,0
23179,CLOCK MAGNET MUM'S KITCHEN,0
23178,JAM CLOCK MAGNET,0
22981,PANTRY APPLE CORER,0
84249A,check,0
37423,WHITE WITH BLACK CATS PLATE,0
23180,MUM'S KITCHEN CLOCK,0
23049,RECYCLED ACAPULCO MAT RED,0
23053,RECYCLED ACAPULCO MAT PINK,0
23054,RECYCLED ACAPULCO MAT LAVENDER,0
23050,RECYCLED ACAPULCO MAT GREEN,0
23052,RECYCLED ACAPULCO MAT TURQUOISE,0
23051,RECYCLED ACAPULCO MAT BLUE,0
79026B,"S/4 ICON COASTER,ELVIS LIVES",0
23128,DOLLCRAFT BOY JEAN-PAUL ,0
23185,FRENCH STYLE STORAGE JAR JAM,0
23184,BULL DOG BOTTLE OPENER,0
90084,PINK CRYSTAL GUITAR PHONE CHARM,0
35607B,BLACK FEATHER CHRISTMAS DECORATION,0
90038C,GLASS AND BEADS BRACELET IVORY,0
20681,MIA,0
62096B,PURPLE/TURQ FLOWERS HANDBAG,0
21736,Adjustment,0
gift_0001_10,Dotcomgiftshop Gift Voucher 10.00,0
84593,CROCHET ROSE DES CLOTHES HANGER,0
16248B,BLUE HOLE PUNCH,0
21841,BABY MOUSE RED GINGHAM DRESS,0
23181,BULL DOG BOTTLE TOP WALL CLOCK,0
23187,FRENCH STYLE STORAGE JAR BONBONS,0
84598,check,0
23126,DOLLCRAFT GIRL AMELIE,0
22423,damages,0
85172,Dotcom set,0
23186,FRENCH STYLE STORAGE JAR CAFE ,0
85172,wrongly sold as sets,0
85175,Amazon sold sets,0
85175,dotcom sold sets,0
85175,wrongly sold sets,0
85175,? sold as sets?,0
85172,?sold as sets?,0
84086B,YELLOW/BLUE RETRO RADIO,0
79063C,"RETRO PILL BOX KEY CHAIN,THE KING",0
23010,CIRCUS PARADE BABY GIFT SET,0
23007, SPACEBOY BABY GIFT SET,0
35610C,Thrown away.,1
35611B,thrown away,1
35610B,thrown away,1
35610A,thrown away,1
23009,I LOVE LONDON BABY GIFT SET,0
23008,DOLLY GIRL BABY GIFT SET,0
20893,damages/display,0
21527,damages,0
40016,damaged stock,0
21320,broken,0
72140F,throw away,0
84535A,ENGLISH ROSE NOTEBOOK A6 SIZE,0
16202A,PASTEL PINK PHOTO ALBUM ,0
21395,BLUE POLKADOT BEAKER ,0
22719,wrong barcode (22467),0
22467,wrongly sold (22719) barcode,0
21833,damages,0
85098B,BLUE FLYING SINGING CANARY,0
84842,HELLO SAILOR BATHROOM SET,0
84227,HEN HOUSE W CHICK IN NEST,0
16161G,WRAP BAD HAIR DAY,0
85132c,CHARLIE AND LOLA FIGURES TINS,1
16259,PIECE OF CAMO STATIONERY SET,0
47013A,WINE BOTTLE DRESSING LT.BLUE,0
22687,DOORMAT CHRISTMAS VILLAGE,0
84977,WIRE FLOWER T-LIGHT HOLDER,0
84946,ANTIQUE SILVER T-LIGHT GLASS,0
84968B,SET OF 16 VINTAGE IVORY CUTLERY,0
90075,MONTANA DIAMOND CLUSTER NECKLACE,0
90068,"RUBY GLASS NECKLACE 42""",0
35910B,PINK FLOWERS RABBIT EASTER,0
84828,JUNGLE POPSICLES ICE LOLLY MOULDS,0
84750A,PINK SMALL GLASS CAKE STAND,1
78033,FLAG OF ST GEORGE CHAIR,0
37488A,YELLOW PINK FLOWER DESIGN BIG BOWL,0
85030,FRENCH CHATEAU OVAL PLATTER,0
21637,ASSORTED SANSKRIT MINI NOTEBOOK,0
47344B,BLUE FLOWER DES PURSE,0
46126A,ELVIS WALLHANGING / CURTAIN,0
90182B,AMETHYST 3 BEAD DROP EARRINGS,0
21689,wrong barcode,0
85025C,barcode problem,0
37330,BIG POLKADOT MUG,0
22459,?lost,0
90124C,GREEN MURANO TWIST NECKLACE,0
90131,PINK/AMETHYST/GOLD NECKLACE,0
85224,ASSORTED COLOUR SILK GLASSES CASE,0
72759,thrown away-can't sell.,0
72732,thrown away-can't sell,0
23077,DOUGHNUT LIP GLOSS ,0
23076,ICE CREAM SUNDAE LIP GLOSS,0
23078,ICE CREAM PEN LIP GLOSS ,0
21770,OPEN CLOSED METAL SIGN,1
47013C,WINE BOTTLE DRESSING DARK BLUE,0
84548,CROCHET BEAR RED/BLUE  KEYRING,0
15030,FAN BLACK FRAME ,0
47593A,found,0
21621,rcvd be air temp fix for dotcom sit,0
22985,WRAP BILLBOARD FONTS DESIGN,0
23159,SET OF 5 PANCAKE DAY MAGNETS,0
23154,SET OF 4 JAM JAR MAGNETS,0
23156,SET OF 5 MINI GROCERY MAGNETS,0
23155,KNICKERBOCKERGLORY MAGNET ASSORTED ,0
84569C,PACK 4 FLOWER/BUTTERFLY PATCHES,0
23158,SET OF 5 LUCKY CAT MAGNETS ,0
85145,JARDIN ETCHED GLASS LARGE BELL JAR,0
21839,MUMMY MOUSE RED GINGHAM RIBBON,0
85028S,FRENCH CHATEAU SMALL FRUITBOWL,0
85028L,FRENCH CHATEAU LARGE FRUIT BOWL ,0
35241,damages?,0
21621,re dotcom quick fix.,0
85049b,LUSH GREENS RIBBONS,0
85049d,BRIGHT BLUES RIBBONS ,0
16156L,WRAP CAROUSEL,0
84856S,SMALL TAHITI BEACH BAG,0
20821,GOLDIE LOOKING MIRROR,0
22127,Dotcom sold in 6's,0
22127,sold in set?,0
82494L,cracked,0
22719,sold as 22467,0
84743C,ORANGE FELT VASE + FLOWERS,0
23157,SET OF 6 NATIVITY MAGNETS ,0
21614,SET OF 12 ROSE BOTANICAL T-LIGHTS,0
84549,CROCHET WHITE RABBIT KEYRING ,0
90014C,SILVER/BLACK ORBIT NECKLACE,0
84313B,Damaged,0
35649,VINTAGE BEAD COSMETIC BAG ,0
35809B,ENAMEL BLUE RIM TEA CONTAINER,0
84686,BEACH HUT MIRROR,0
22286,DECORATION WOBBLY RABBIT METAL ,0
84576,BLUE CAT BISCUIT BARREL PINK HEART,0
84228,HEN HOUSE WITH CHICK STANDING,0
79030D,TUMBLER BAROQUE,0
84743C,damages,0
22287,DECORATION WOBBLY CHICKEN,0
84877A,PINK ROUND COMPACT MIRROR,0
84875D,BLUE SQUARE COMPACT MIRROR,0
23254,CHILDRENS CUTLERY DOLLY GIRL ,0
23256,CHILDRENS CUTLERY SPACEBOY ,0
21620,mystery! Only ever imported 1800,0
21830,"MERCHANT CHANDLER CREDIT ERROR, STO",0
21622,POSSIBLE DAMAGES OR LOST?,0
90024D,NEW BAROQUE B'FLY NECKLACE PINK,0
23255,CHILDRENS CUTLERY CIRCUS PARADE,0
79030G,TUMBLER NEW ENGLAND,0
22039,BOTANICAL LILY GIFT WRAP,0
90025A,BAROQUE BUTTERFLY EARRINGS BLACK,0
37487B,YELLOW/ORANGE FLOWER DESIGN PLATE,0
84839,SWEETHEART KEY CABINET,0
23205,CHARLOTTE BAG VINTAGE ALPHABET ,0
23201,JUMBO BAG ALPHABET,0
23207,LUNCH BAG ALPHABET DESIGN,0
23199,JUMBO BAG APPLES,0
23206,LUNCH BAG APPLE DESIGN,0
23204,CHARLOTTE BAG APPLES DESIGN,0
23205,CHARLOTTE BAG ALPHABET  DESIGN,0
23256,KIDS CUTLERY SPACEBOY ,0
23254,KIDS CUTLERY DOLLY GIRL ,0
23208,LUNCH BAG VINTAGE LEAF DESIGN,0
84689,S/2 BEACH HUT TREASURE CHESTS,0
21100,Damaged,0
35915C,damaged,0
37488A,damaged,0
37487B,Damaged,0
37482P,Damaged,0
44242B,PINK FEATHERS CURTAIN,0
85167B,DAMAGED,0
PADS,PADS TO MATCH ALL CUSHIONS,0
85132b,CHARLIE AND LOLA TABLE TINS,1
84510e,SET OF 4 GREEN CAROUSEL COASTERS,0
22785,SQUARECUSHION COVER PINK UNION JACK,1
84731,3 BIRDS CANVAS SCREEN,0
23065,LARGE DECO JEWELLERY STAND,0
16202B,PASTEL BLUE PHOTO ALBUM ,0
23060,HEART BEADED TRELLIS DECORATION,0
23057,GEMSTONE CHANDELIER T-LIGHT HOLDER,0
23253,16 PIECE CUTLERY SET PANTRY DESIGN,0
23057,BEADED CHANDELIER T-LIGHT HOLDER,0
47556B,did  a credit  and did not tick ret,0
23348,CHILDRENS TOY COOKING UTENSIL SET,0
90181C,BLACK GLASS/SHELL/PEARL NECKLACE,0
23066,SMALL DECO JEWELLERY STAND,0
23068,ALUMINIUM STAMPED HEART,0
23075,DOUBLE CERAMIC PARLOUR HOOK,0
23153,ZINC SWEETHEART WIRE LETTER RACK,0
90036C,"FLOWER GLASS GARLAND NECKL.36""BLUE",1
23075,PARLOUR CERAMIC WALL HOOK,0
23073,GEORGIAN TRINKET BOX,1
90135A,ORANGE/FUSCHIA STONES NECKLACE,0
90159,COTE D'AZURE NECKLACE,0
23146,TRIPLE HOOK ANTIQUE IVORY ROSE,0
23061,VINTAGE EMBOSSED HEART,0
20823,GOLD WINE GOBLET,0
20827,GOLD APERITIF GLASS,0
23055,IVORY CHANDELIER T-LIGHT HOLDER,0
23056,FLOWERS CHANDELIER T-LIGHT HOLDER,0
20997,ROSE DU SUD CUSHION COVER ,0
23140,TRIPLE WIRE HOOK IVORY HEART,0
23141,TRIPLE WIRE HOOK PINK HEART,0
23135,SMALL ZINC HEART WALL ORGANISER,0
23132,SMALL IVORY HEART WALL ORGANISER,0
23071,MARIE ANTOIENETT TRINKET BOX GOLD,1
23152,IVORY SWEETHEART WIRE LETTER RACK ,0
84763,Display,0
23134,LARGE ZINC HEART WALL ORGANISER,0
23133,LARGE IVORY HEART WALL ORGANISER,0
22458,Missing,0
84990,60 GOLD AND SILVER FAIRY CAKE CASES,0
23147,SINGLE ANTIQUE ROSE HOOK IVORY,0
23148,MINIATURE ANTIQUE ROSE HOOK IVORY,0
23144,ZINC T-LIGHT HOLDER STARS SMALL,0
23142,IVORY WIRE KITCHEN ORGANISER,0
23136,IVORY WIRE SWEETHEART LETTER TRAY,0
23139,SINGLE WIRE HOOK PINK HEART,0
23138,SINGLE WIRE HOOK IVORY HEART,0
23150,IVORY SWEETHEART SOAP DISH,0
23145,ZINC T-LIGHT HOLDER STAR LARGE,0
20827,damages,0
22784,damages,0
84906,PINK BUTTERFLY CUSHION COVER,0
21319,adjustment,0
17109D,Adjustment,0
17091A,found,0
84531A,returned,0
84531B,returned,0
90025B,BAROQUE BUTTERFLY EARRINGS RED,0
47013A,damaged,0
23137,ZINC WIRE SWEETHEART LETTER TRAY,0
72024U,LILAC VOTIVE CANDLE,0
22467,wrong code?,0
22719,wrong code,0
16049,TEATIME GEL PENS ASST,0
23069,EDWARDIAN PHOTO FRAME,0
16244B,MAXWELL 2 TONE BLUE 60 PAGE PHOTO A,0
23131,MISTLETOE HEART WREATH CREAM,0
23067,HANGING ENGRAVED METAL HEART,0
51020A,adjustment,0
51020B,adjust,0
47341B,BLUE TABLE RUN FLOWER,1
62097B,BLUE STRIPES SHOULDER BAG,0
62043B,BLUE CHECK BAG W HANDLE 34X20CM,0
90021,LASER CUT MULTI STRAND NECKLACE,0
23163,REGENCY SUGAR TONGS,0
23284,DOORMAT KEEP CALM AND COME IN,0
23283,DOORMAT VINTAGE LEAVES DESIGN ,0
23162,REGENCY TEA STRAINER,0
48189,damaged,0
48189,adjustment,0
21398,damages,0
85017C,Found,0
84228,crushed,0
84016,FLAG OF ST GEORGE CAR FLAG,0
DCGS0004,HAYNES CAMPER SHOULDER BAG,0
20838,FRENCH LATTICE CUSHION COVER ,0
72811,SMALL ZINC/GLASS CANDLEHOLDER,0
20816,GOLD FLOWER CUSHION COVER ,0
23048,SET OF 10 LANTERNS FAIRY LIGHT STAR,0
23042,PAPER LANTERN 7 POINT SNOW STAR,0
23041,PAPER LANTERN 9 POINT SNOW STAR,0
23040,PAPER LANTERN 9 POINT SNOW STAR ,0
23064,CINDERELLA CHANDELIER ,0
85225,BLING KEY RING STAND,0
37471,MULTICOLOUR POLKADOT PLATE,0
23130,MISTLETOE HEART WREATH GREEN,0
84629,WHITE 3 FRAME BIRDS AND TREE ,0
22987,WRAP SUMMER ROSE DESIGN,0
20836,FRENCH PAISLEY CUSHION COVER,0
23160,REGENCY TEA SPOON,0
23161,REGENCY CAKE FORK,0
23164,REGENCY CAKE SLICE,0
23149,ANTIQUE IVORY WIRE BOWL SMALL,0
23148,MINITURE ANTIQUE ROSE HOOK IVORY,0
84705C,PINK FLOCK PHOTO FRAME ,0
22655,damages/showroom etc,0
21656,samples,0
23143,ZINC WIRE KITCHEN ORGANISER,0
79164,damages/credits from ASOS.,0
23299,FOOD COVER WITH BEADS SET 2 ,0
23298,SPOTTY BUNTING,0
23070,EDWARDIAN HEART PHOTO FRAME,0
23151,ZINC SWEETHEART SOAP DISH,0
90058A,CRYSTAL STUD EARRINGS CLEAR DISPLAY,0
23040,PAPER LANTERN 9 POINT SNOW STAR,0
23043,PAPER LANTERN 9 POINT HOLLY STAR 40,0
23045,PAPER LANTERN 5 POINT STAR MOON 30,0
23041,PAPER LANTERN 6 POINT SNOW STAR,0
23298,"BUNTING , SPOTTY ",0
20964,POLYESTER FILLER PAD 60x40cm,0
23200,mailout ,0
23202,mailout,0
23203,mailout,0
84859B,BLUE DISCO HANDBAG,0
23209,mailout,0
23202,JUMBO BAG VINTAGE LEAF,0
23200,JUMBO BAG PEARS,0
23203,JUMBO BAG DOILEY PATTERNS,0
23209,LUNCH BAG DOILEY PATTERN ,0
23071,MARIE ANTOINETTE TRINKET BOX GOLD,1
23072,MARIE ANTOINETTE TRINKET BOX SILVER,1
23043,PAPER LANTERN 9 POINT HOLLY STAR L,0
23046,PAPER LANTERN 9 POINT DELUXE STAR,0
23047,PAPER LANTERN 5 POINT SEQUIN STAR,0
23044,PAPER LANTERN 9 POINT HOLLY STAR S,0
23044,PAPER LANTERN 9 POINT HOLLY STAR 23,0
23047,PAPER LANTERN 5 POINT STUDDED STAR,0
23299,"FOOD COVER WITH BEADS , SET 2 SIZES",0
90036A,FLOWER GARLAND NECKLACE RED,1
22667,damaged,0
22796,Not rcvd in 10/11/2010 delivery,0
90083,CRYSTAL CZECH CROSS PHONE CHARM,0
23282,FOLDING BUTTERFLY MIRROR IVORY ,0
23280,FOLDING BUTTERFLY MIRROR HOT PINK ,0
23190,BUNDLE OF 3 SCHOOL EXERCISE BOOKS  ,0
23191,BUNDLE OF 3 RETRO NOTE BOOKS,0
23192,BUNDLE OF 3 ALPHABET EXERCISE BOOKS,0
23191,BUNDLE OF 3 RETRO EXERCISE BOOKS,0
23175,REGENCY MILK JUG PINK ,0
23174,REGENCY SUGAR BOWL GREEN,0
23173,REGENCY TEAPOT ROSES ,0
23172,REGENCY TEA PLATE PINK,0
23171,REGENCY TEA PLATE GREEN ,0
23170,REGENCY TEA PLATE ROSES ,0
23081,GREEN METAL BOX ARMY SUPPLIES,0
23084,RABBIT NIGHT LIGHT,0
23281,FOLDING BUTTERFLY MIRROR RED  ,0
84509g,SET OF 4 FAIRY CAKE PLACEMATS ,0
23118,PARISIENNE JEWELLERY DRAWER ,0
23096,PETIT TRAY CHIC,0
23091,ZINC HERB GARDEN CONTAINER,0
23094,LE GRAND TRAY CHIC SET,0
23108,SET OF 10 LED DOLLY LIGHTS,0
23080,RED METAL BOX TOP SECRET,0
23081,GREEN METAL BOX TOP SECRET,0
23110,PARISIENNE KEY CABINET ,0
23059,Thrown away-rusty,0
23100,SILVER BELLS TABLE DECORATION,0
23102,SILVER HEARTS TABLE DECORATION,0
23061,VINTAGE ENGRAVED HEART,0
23082,SET 6 PAPER TABLE LANTERN HEARTS ,0
16151A,FLOWERS HANDBAG blue and orange,0
23093,SMALL PARISIENNE HEART PHOTO FRAME ,0
23280,FOLDING MIRROR HOT PINK ,0
23109,LED TEA LIGHTS,0
23103,BELL HEART DECORATION,0
23068,ALUMINIUM HEART,0
23056,CRYSTAL CHANDELIER T-LIGHT HOLDER,0
23112,PARISIENNE CURIO CABINET,0
23111,PARISIENNE SEWING BOX,0
23079,TOADSTOOL BEDSIDE LIGHT ,0
23167,SMALL CERAMIC TOP STORAGE JAR ,0
23104,IVORY PANTRY HANGING LAMP ,0
23168,CLASSIC SUGAR DISPENSER,0
23131,MISELTOE HEART WREATH WHITE,0
23130,MISELTOE HEART WREATH ,0
23169,CLASSIC GLASS SWEET JAR,0
23165,LARGE CERAMIC TOP STORAGE JAR,0
23065,LARGE JEWELLERY STAND,0
23066,SMALL JEWELLERY STAND,0
23101,SILVER STARS TABLE DECORATION,0
23089,GLASS BON BON JAR,0
23107,WHITE WIRE PLANT POT HOLDER,0
23169,CLASSIC GLASS COOKIE JAR,0
23168,CLASSIC CAFE SUGAR DISPENSER,0
23088,ZINC HEART FLOWER T-LIGHT HOLDER,0
23103,JINGLE BELL HEART DECORATION,0
23106,ZINC HEARTS PLANT POT HOLDER,0
23107,WHITE HEARTS WIRE PLANT POT HOLDER,0
23087,ZINC  HEART T-LIGHT HOLDER,0
23091,METAL HERB GERDEN CONTAINER,0
23106,ZINC PLANT POT HOLDER,0
23282,FOLDING MIRROR IVORY ,0
23281,FOLDING MIRROR RED  ,0
84879,damaged,0
90035C,"PEARL & SHELL 42""NECKL. IVORY",0
23083,SET 6 PAPER TABLE LANTERN STARS ,0
23301,GARDENERS KNEELING PAD KEEP CALM ,0
23300,GARDENERS KNEELING PAD CUP OF TEA ,0
23302,KNEELING MAT HOUSEWORK  DESIGN,0
47574B,ENGLISH ROSE SCENTED HANGING HEART,0
23090,VINTAGE GLASS T-LIGHT HOLDER,0
23092,LARGE ANTIQUE WHITE PHOTO FRAME,0
23085,ANTIQUE SILVER BAUBLE LAMP  ,0
23099,FRENCH CARRIAGE LANTERN,0
23086,ZINC  STAR T-LIGHT HOLDER ,0
37370,sold as set/6 by dotcom,0
15058A,wet/rusty,0
15058C,wet/rusty,0
37370,damages/dotcom?,0
20803,damages,0
21181,on cargo order,0
84873A,FUNKY FLOWER PICNIC BAG FOR 4,0
22179,SET 10 NIGHT OWL LIGHTS,0
84661a,WHITE SQUARE TABLE CLOCK,0
23129,HEART SHAPED HOLLY WREATH,0
90081B,LILY BROOCH WHITE/SILVER COLOUR,0
85017C,adjustment,0
84804B,BLUE DELPHINIUM ARTIFICIAL FLOWER,0
23104,IVORY CAFE HANGING LAMP ,0
84984B,RED PEONY CUSHION COVER ,0
84984A,GREEN PEONY CUSHION COVER,0
90149,SILVER FLOWR PINK SHELL NECKLACE,0
84563A,damaged,0
79030G,damages,0
79030D,damages,0
23145,ZINC T-LIGHT HOLDER STARS LARGE,0
22700,smashed,0
85034a,3 GARDENIA MORRIS BOXED CANDLES,1
23253,16 PC CUTLERY SET PANTRY DESIGN,0
85132A,damaged,0
21310,CAPIZ CHANDELIER,0
90018C,SILVER BLACK ORBIT DROP EARRINGS,0
47566B,incorrectly credited C550456 see 47,0
47566B,reverse previous adjustment,0
23228,FILIGREE HEART BIRD WHITE ,0
84596l,BISCUITS SMALL BOWL LIGHT BLUE,0
23227,FILIGREE HEART BUTTERFLY WHITE ,0
23086,ZINC STAR T-LIGHT HOLDER ,0
